date,headline,summary,url,source,category,keyword,oil_relevance,is_noise
2016-05-06,Mother charged for abusing toddlers who were found tied up in Texas backyard,Mother charged for abusing toddlers who were found tied up in Texas backyard Reuters,https://news.google.com/rss/articles/CBMizAFBVV95cUxQNDZ2c3VKVjZ3YXpmb1RqVDhrLVlENzNCTmFWSTUxZGQ0R0xtRzF2a1B4NXY4OFhQa0dzWkdnTmo2b0xGUV9mWEFyaTJHWjFUVEpPWEhSMGgxM0IzMDEwR01JdEpqZk0yUng5VnEyRzlIQ1hYQ05NWmV6d01jeVJFODBnV19QbS1hblVMeFBvREhKTmRhdGE2cS1PdTB0ZF9Eb3hkZkZUeUNlY01pSHJoTkw2R2J0QnY0Mi1tdVcwVklOdVpMWHZzTjBHUXg?oc=5,Reuters,supply,crude oil exports,0,True
2016-05-05,Former Texas policeman released after serving 21 years for rape,Former Texas policeman released after serving 21 years for rape Reuters,https://news.google.com/rss/articles/CBMiuwFBVV95cUxQZlhNWWhrZEt4RWE0N1hIbENsZ0VWMFAtWHY2R1hxM2ZCTGlHSlAwVXdOQUtVclZ3MS0yMV8xa3dDUGQzUG9xbUZkdm5tNzNPSlc1d2otSXZ6UHFqLW9rTG96MFMwdWNDMUFWNGctazZlV3c0c2NEZWxabnVOQWxvYjRvdzQ0dHpZYXZjZG1MR1Jaa2VHcjNUcGhBdElVbEUtUWFiSExJZXFRbHZnUW5pdHpKUW5yRVk3MEtn?oc=5,Reuters,supply,crude oil exports,0,True
2016-05-05,U.S. oil industry bankruptcy wave nears size of telecom bust,U.S. oil industry bankruptcy wave nears size of telecom bust Reuters,https://news.google.com/rss/articles/CBMivAFBVV95cUxNTGc1Vk13YUtDMmdOYWpnT1B6Sm1PRnRyaDRfOEFxSllYeXNkWFhXRjNfajhfWmJCUjFhQmRhMXY0bWpIUnBnYnh0SmJiUC1mRmZsQ3JCUTlCYXNHbnhVNjdLWjBWQjFrMmVjWXplZUpMTmtvQkh6anZ1TzFVbWRnTmJoRl9pS2lFUmVjdHZmOVEzQXpTU2dSWm9FaTc2eDhIOUZDREVxQUhzd1FJVVR2Y3ZXc2plY2hVQkdWdg?oc=5,Reuters,supply,US shale oil production,2,False
2016-05-05,Saudi prince makes bold challenges to kingdom's old ways,Saudi prince makes bold challenges to kingdom's old ways Reuters,https://news.google.com/rss/articles/CBMirAFBVV95cUxPQ2RoNjZfRmZuUVNqR0VqUGZxNjlKc1JOQXVSdGdHV0puODNpNUZiNnNHaUx0RC1LRG5fTG52MXJmSXYycXVxUFVxMU5CUVpZZFB3b0Z5VnQwNEJCenp3ZXhpSG4yeDlxalU5Wi1JRThISm0xTUFYU3N6UGg0Z0YtSzhjZ2RwRmY3VGJmWTRmQU1tOWhWeFNUc0tXdHAyazRabjdSU3RtX1VzdUsx?oc=5,Reuters,supply,crude oil exports,0,True
2016-05-03,MetLife to pay $25 million for annuity sales violations: FINRA,MetLife to pay $25 million for annuity sales violations: FINRA Reuters,https://news.google.com/rss/articles/CBMiswFBVV95cUxOVjhWQXI1S0dNVEcwVDFCdVh1V19zRUFZU0ZRaExFblRnV0Nod3hVQkpVUzNoT3NtR1RBTzFfM21CVFFfV1E4d1U4RzFNX1NMbzhHMEZUQUNwdUIwdDY5NEVrYWxhN1VobVc5QmF2R2Z5VlFVMHZYd3UxdUFXeUx6ZWUzZENZdlE4T2tmYkRsWVpYOVZWNWx4cHlqY0ZNWmZhc1JmbXp1OXY2RmxpR21rcWxRYw?oc=5,Reuters,supply,crude oil exports,0,True
2016-05-03,Suncor says cutting production due to Fort Mac wildfire,Suncor says cutting production due to Fort Mac wildfire Reuters,https://news.google.com/rss/articles/CBMib0FVX3lxTE83TlQtSmo2bEFLTUl1LWczRHZXblgtaW5KbXh0OW9scGFWdEhnT1FnSFg2d0Q5dlV6QmpnTFo3M2pES2RxcWVmanV1TnFwZV9pWU1RM0VOZWF6T2xYUTg2WHcxVl8wdnZBb1dmeUlpNA?oc=5,Reuters,supply,US shale oil production,2,False
2016-05-03,Warehouses de Pauw Q1 net result rises to 22.2 million euros,Warehouses de Pauw Q1 net result rises to 22.2 million euros Reuters,https://news.google.com/rss/articles/CBMitAFBVV95cUxOWU85REg1eWJqUEMtVGNFaVZqM1FpcGpXRnV4bkMyMjZudW9vTXk0TUJkQ0dBeU5OSTd5M01rNzdfSlZqSFdVWjlDR3I3UjcxdXFSX3pROHZkWE83NGY4T0FXdFBtTVlVVG82RlNfZ25jcjZ3QmRIWlVPVHFWOWdaUHc1azBCVEk4a0lRV0duQXo2dkZsUjhFYV9CMUJubmRSRGptS0hEWC1UNkUxZUNob2xOYkw?oc=5,Reuters,supply,US shale oil production,1,False
2016-05-02,Oil price maker Jorge Montepeque joins Italy's energy major Eni,Oil price maker Jorge Montepeque joins Italy's energy major Eni Reuters,https://news.google.com/rss/articles/CBMiwwFBVV95cUxQMl8ybmY5cU1DVzlUcm9WVklLZzY3T0JoOHZUVXNzX0ZjeHVnZXZsQVZmcUxXN3U4amt1b1p6LVVSNlF5dk9RRTNNcVRMbWo3OTdQUndhVGNrM2gwRzhra0VMRDRsNmF4UTJmaEZLbGZybjdNdXRPSzAxb2NQcEc4SXpzRFRkT0dzelB3TU1lal81RV9pUmxkZFJ4eU1wMXR4QXBpS2NXb01HNzd1MGQ4TXFMZkdRbXI0c2JKQk1maS1ZdHc?oc=5,Reuters,supply,crude oil exports,2,False
2016-04-29,Bundesbank's Weidmann defends ECB against German critics,Bundesbank's Weidmann defends ECB against German critics Reuters,https://news.google.com/rss/articles/CBMisAFBVV95cUxOcnNmakdCdFBsR3pVZTVva1czUF9iYnctTkVYVlp4MDNNd3dDSUdQN0EzUWdIcEpyWDdzTDhVM1JtakhlNUhJakpveUc5YU96akREeUpSQU5MaGlocERhSjV2cEtZc0JBRUlYS3JrdDVuM2hmRVFOcm9BS1o2OHlsM2lOZkM0M05BR0Q3NzFkRUV6bmdVSzRCMURoZHVTb3REVjRWMFdaZHc3WGhsalIxNQ?oc=5,Reuters,supply,crude oil exports,0,True
2016-04-28,Mexico's Pemex posts narrower first quarter loss,Mexico's Pemex posts narrower first quarter loss Reuters,https://news.google.com/rss/articles/CBMipgFBVV95cUxOS1pjQmwzLXFVNDFkMy1XU1k1ZldoYTc2Q1V3RklxSjl5OWE3R0ZjdkJaV0lUZmxoSHE5Y3I0aG15aW1vRWc0UlN6WFVXYTgwVC1odHo2UnpybV80b2tYT3E4cG02VGFRbzhfUDIyb1lySWxqcGFVX2htM0NjQ1VVbDR2dGdwU1V4dGwzSFpUSDg0YmlNdkQ2WkpLQW9lZ3RzVk9yVkNB?oc=5,Reuters,supply,crude oil exports,0,True
2016-04-27,Detour Gold reports Q1 earnings per share $0.16,Detour Gold reports Q1 earnings per share $0.16 Reuters,https://news.google.com/rss/articles/CBMiogFBVV95cUxOd1ZJSlhlaGQxSXpjUW1zeUpzamthR185eUVEZmhVeXlPdFZDMnNIdC14b1o0Um85Qm8yWlRTOGUzNmxUbFIzT05vZjZZUVFIazZydzhVaEZWbVdUMlVpWUlHMkl2R3FNeHJwZ24wVGlPZGI1aFlIOVBKWWpCMjh5UTQ4THVRRDdBNlQzbzdhS3lMdk5raExWYUlmVVJPenpZdEE?oc=5,Reuters,supply,US shale oil production,-1,True
2016-04-22,U.S. oil baron Harold Hamm endorses Trump for president,U.S. oil baron Harold Hamm endorses Trump for president Reuters,https://news.google.com/rss/articles/CBMiqgFBVV95cUxNV29vUmtfenpQbkRRU3p1cENaMTM1cnpUbG5vRnNmdlFtOE1mMVRJOTZleWpydEV2VGhoS2lEbUNOQ3R4ZFNQNzk4Mmd3QjAyaG1udzlYLWIwaE5wM3RLd0RxV3p0aExkRWJUS0JLeUhmMWxuV2JQUmZjTEdsTmZ4MjZCSVhsRi1MN3lPSFRSaE9ydmwtRHp3NDlhWWV4U0ZYbTZJdWFWcmVlZw?oc=5,Reuters,supply,US shale oil production,2,False
2016-04-21,EQT Mid Market Fund invests in In.corp Group,EQT Mid Market Fund invests in In.corp Group Reuters,https://news.google.com/rss/articles/CBMinwFBVV95cUxNcERHdXc5ZlhrbTN6YjFtdzJUXzF0Vnd6TEZBVXM3Z1dUNkxYR2xGOFFXWlI3Q25aZ2JUUmNPZFJpVlN2Wnp2djZ3Zmk1RERtUEE1OGxMU1V6ZEpFSDVMcWlsWXd4S3pSREhMX2Z4WjZfdWhzZXlUcHRWLTV3VVcwUk50TlYxU2JueS11RzdZeE5fb2dLWVdGb3BtbjlnMFk?oc=5,Reuters,supply,oil inventory,0,True
2016-04-20,U.S. home sales rebound signals strong spring selling season,U.S. home sales rebound signals strong spring selling season Reuters,https://news.google.com/rss/articles/CBMisAFBVV95cUxOZXJwOEVQdUY5WnBlb1ZlRllBS1huUVJ0RW5KakJrMjRoby1TUVdlSDNLRUZZR2gzQ2JpZWRVbzVGNTFJdEtET3RnTTlya1NSM0NjalhzTnE0eTFEV0N3QzNtcG1ubEZXTGIyVURldVhxZWRnbXVobERXd19TMUxYbXgyNUwyWTRoZF9va2ZlS290TkR6N1R4aEFyaWUzcHNDTjhNb3hmSGJkMXM3ZWVsTw?oc=5,Reuters,supply,oil inventory,0,True
2016-04-15,- Topic Codes - Reuters Liaison,- Topic Codes Reuters Liaison,https://news.google.com/rss/articles/CBMiWEFVX3lxTFBOVE9paHQtNnpuNWtUTXN6UmpvaHVjM3NWZ0thREhsUzNrMlNlZkZIZUxlc0NLMTg0VUlHa1RBV1E0N2E4WFVQT1ZkZS1GZ2VHMG9vbTZSUHY?oc=5,Reuters,supply,OPEC production,0,True
2016-04-13,Platinum Partners hedge funds are hot -- maybe too hot for big money,Platinum Partners hedge funds are hot -- maybe too hot for big money Reuters,https://news.google.com/rss/articles/CBMigAFBVV95cUxQLTVOd2JrTzhfTHMwQXNyb0VlNnNiXy1MM09YcE1YZFlvMjRJNmFmTFgxM3RkT2FTRlpFRGFwQV9sbUpQZ2FaZTNwS21nNDRkRXgwUV9IZ3FDTHdhUmhUUC1RQjhYWnRJTVRvU1VnNG9sMFBFTEJsWXBQN3JsYUpHcA?oc=5,Reuters,supply,oil drilling activity,0,True
2016-04-13,Leading global coal miner Peabody files for bankruptcy,Leading global coal miner Peabody files for bankruptcy Reuters,https://news.google.com/rss/articles/CBMirwFBVV95cUxPSkhjUEozb3JQQ3I2c1p1U0tDY0dPSld0OUJLejlVa2RiLTBDdW5Nb0R1MGZOYzRMVm5ZdUNvTFVuSmhhemIyTnpnZ19KdEdxNENPNjJmcVM3WnIzRTdsU3VBS1hxRkNkN0o4UTZDWVpXMEtOdEg5ZEpuc08yWHVxeFp1RFg1SFZHYnoxUGFvZ1R1X09JY1VmOHVmcUJ3Z2ExZ0Q2UE5aMUpLNWRhZ0hZ?oc=5,Reuters,supply,US shale oil production,0,True
2016-04-08,How Saudi Arabia's war in Yemen has made al Qaeda stronger – and richer,How Saudi Arabia's war in Yemen has made al Qaeda stronger – and richer Reuters,https://news.google.com/rss/articles/CBMib0FVX3lxTFBGb1NHeW85ek1RY3FpQXRubHpfc0twMjlLN2lrYVMwcDBBUDFsYUtSUTNNbllHc0RyUTEyTjlMYXh1WnNaX3BUWURJS3lKNDJBci1BZmxxZG91UDRKclZxUUt3d1JudnpXRG9vZ1A5RQ?oc=5,Reuters,supply,crude oil exports,0,True
2016-04-08,Race for run-off spot heats up ahead of Peru election,Race for run-off spot heats up ahead of Peru election Reuters,https://news.google.com/rss/articles/CBMiqgFBVV95cUxORmczaFp0T3BPNkY3UE9OUUdwS01XUHpqMTl2Yy1TVDZlbDdNcmRyT3poY2hxa3BSaUtKUS0yQ1VRYUZLLURKVzFYb3BnbE1mY1RTUmZSaVhkT0JSdTl2eG16Znh5R1hmbWUyMElDR1Mwa2FQVWVvc25USWdqbWVmazVSclZkWnMzelFFc2FUcDdNZ1dYY0pJNzRjajVoVmRpLXVRQ1dNbzd4QQ?oc=5,Reuters,supply,crude oil exports,0,True
2016-04-06,No prison terms for Gulf spill as final defendant gets probation,No prison terms for Gulf spill as final defendant gets probation Reuters,https://news.google.com/rss/articles/CBMizAFBVV95cUxNeVVQNlhIOHZmZUYtQkJxY2dQa29EaVFycnNvSkx5ZmgwXzNhcTZzZy1JNkMwdlFkWUI0ZW9DMVJzamJOSW5sS3RCUVBDd2VHenRaOFIwYkJPY1U5MDFtejRwcktyVnlfbkMzQ1RfY193WHVQSU84eFVxZVlqWFhtc0pJR29qbEYycjhyQlZyb0JUSlpVVTR3dzlnQnN6Tk9jVl94X3huQnJBRl8yZlhWMmVXWHd2ejA0aWVFUmFmYjByYXpvWU5lWnMzQkc?oc=5,Reuters,supply,oil inventory,0,True
2016-04-05,Oil glut up close: How Cushing copes with full crude tanks,Oil glut up close: How Cushing copes with full crude tanks Reuters,https://news.google.com/rss/articles/CBMiswFBVV95cUxPSDFNQ3BLR010alVPa0gyNzE1YTJUQVFBdk9VaHVyN19GLVdPNzdoNzZWLUI5V0dOaDRZMHVxMnFlcUktQm1QYWtINEZUQmYxNWtMa2JURHF1MGxEOE5vNkNsTkFTcXJYaFJtWmNZbldkaWdRMkFnOXpyS3FIRWhLXzRHRENZV3NmQmxDQW9YSGs2UnZubTJBLXIyNHdnS1dDdFNoTlBxUlZMUC01WWNQLXZSOA?oc=5,Reuters,supply,US shale oil production,2,False
2016-03-30,Lululemon Athletica Inc Q4 earnings per share $0.85,Lululemon Athletica Inc Q4 earnings per share $0.85 Reuters,https://news.google.com/rss/articles/CBMipwFBVV95cUxPTVlCM3dNUml2cFkzNDJLamV6a3kzT1NVb2pUY0dqRExaMHpYNVpWWmpqaWdmTHBaYy16anJ0WnhyeDFlaTIwV05VUXE0UXdHV1hWaTRZWVN4T09XRWlTYzk2RlJqSnNJLWtvQWEybllYOHZlTWRUQ05JY05MLTMtNjM2ZDFmT1FFYVRhTHhnSTF3Qk5oQl9IUWhmOUlkZmZCcHIxUnBJSQ?oc=5,Reuters,supply,oil inventory,-1,True
2016-03-29,"China's Shandong Ruyi to take over Sandro, Maje labels - sources","China's Shandong Ruyi to take over Sandro, Maje labels - sources Reuters",https://news.google.com/rss/articles/CBMitwFBVV95cUxOQi1iRnJDS1V3M2daaWUyamhPOUZSVk9PQWJsTjNfNGRFVmRRTWZTUkxvRzlEQ210bDlrcHBMZngxR1I1c1I1cEdZb1hFZGR3Q3hmaER3RmcyQUtYVGxwZVcwZk9oSkJVWTYzejdKbGV6M09qUkJDVjJkcm5mUlFNVDcycnU3UjhhXy1jSllHSUJxTEhudTJXVDhtSC1TYUwyckJjWmY1Z3JBbkY3VlhYNjd1dWNpS00?oc=5,Reuters,supply,crude oil exports,0,True
2016-03-29,Dollar slides after Yellen speech; S&P at 2016 high,Dollar slides after Yellen speech; S&P at 2016 high Reuters,https://news.google.com/rss/articles/CBMiqAFBVV95cUxNMnV0aG15enhtLVcwaGFfcmJWUW94VVNsZk41dmJmWlQ3TmNOZk5pR3VaaGxZWkFPYmI5dVBYMEg2bnp5czE2LVpoSldOREV0d0c3SUZBZnc2ZHg2R25kbWtNM0NxajdaaDU4UWMxSV94dEV1dEo1WE1NQThFUml5anFrejhSZW5jQ2ZKdnNIRXhWdGhtR0l2OFJwNXRDcVowT2xfZnJvMXc?oc=5,Reuters,supply,oil inventory,0,True
2016-03-28,Special Report - College Board gave SAT exams that it knew had leaked,Special Report - College Board gave SAT exams that it knew had leaked Reuters,https://news.google.com/rss/articles/CBMivAFBVV95cUxOcEtHTW14YUhYMzdlV0czTEpfUXpOTERyal9nTnRnUkZtY0JGX0Uxd3NJcW9vS2VuYndhQUdSUEstZ3c4TEZNU0dxR01yVENENmNjUWEyN1FDSFRJNmdUZGlCaVNpaEs1OEU3M0cwZGI3X25qMEhEYW9fbTdQaVIydE56SXNMZE16T0VDNl94M291cDdsRE9ZZ1pEakh2X0xMSW1HbG1WTjBlNnJRSEZnUmtQYWJmUnRPbVNBWA?oc=5,Reuters,supply,oil inventory,0,True
2016-03-28,Sears CEO Lampert buys some of company's debt: sources,Sears CEO Lampert buys some of company's debt: sources Reuters,https://news.google.com/rss/articles/CBMirAFBVV95cUxPUVl1S0Rtc0tVZ25PUl9uYmpTcTlZaG9SQTlLTHc5bzVqaWkyWUdXV3RZemFHVWlpQkRDTld2QzNwMzhaT0h6TkdTcWhULXR0OHVUWkdheS14MmdpWnRnRjhzS2NFY1dsNnEyV0VzUHctWHRXM2d4akxRMzE4S2tvb09SV3JTdm9kOG9xUHJZT2w2bnJHU3FiSkxMTjNYQkdVblZSR3E3UnM5Uklz?oc=5,Reuters,supply,oil inventory,0,True
2016-03-25,"Consumers prop up U.S. economy, but profits under pressure","Consumers prop up U.S. economy, but profits under pressure Reuters",https://news.google.com/rss/articles/CBMisAFBVV95cUxNblhvMXhKOVpFUkVwdEVZeXQ3dFBQZEdBNkpxNm9OdGRBM2NLZUt1QjlORVdXX2ZhcktZTzdWODhfVnduMmtDUnRsNDQ2LVBKaFkzOURWeVNHblZWUDVOS3UzLVVmUVB2aW1tRkoyNjFDTkdRZ0lWUmRCdm13RkNGN3R1aU5pcmFES295aDB0RnhoU2dwME5mY1F3bkRyS21XVVdnakRZWDlsTmNDcnZhYw?oc=5,Reuters,supply,oil inventory,0,True
2016-03-24,"Rockefeller Family Fund hits Exxon, divests from fossil fuels","Rockefeller Family Fund hits Exxon, divests from fossil fuels Reuters",https://news.google.com/rss/articles/CBMitwFBVV95cUxQNTVLUUNTRTRpLXVrN2M5RS16NGx2TlJ2VWZ5OER4ekx5djRRMFBZRmpDM2piV0pKUVpvSDlha0xtRzJMNDRfLURGTUxDRlpuTDBYSkk1bUd3V3Y1Nl90eVZLNWhfXzlMVEMwbFhZMFRrTGF5OXAtSG9GOWdhcXZfWlRnbHRBTnpZSUh6VnB2eXBVNHljVUtPX2xIOFhERndvd1FFYkFRN1Y4SE1CVGlqQlhWejJ6TlE?oc=5,Reuters,supply,crude oil exports,1,False
2016-03-17,India in driver's seat as fuel demand roars at fastest rate ever,India in driver's seat as fuel demand roars at fastest rate ever Reuters,https://news.google.com/rss/articles/CBMitwFBVV95cUxOc0xlTExlR3lZVDRueUpEWV83NlpscVFLQWNXXzEzNVc0UjJzejBuSkp5OUxuV18xRGdlUDI4T2NOZmNKVXB0cXJqSzJUR1R5MVozQ0xueG02UVhaazY2NWRRQ1llWVVRT1pDeC12NXRMcFRGRVJuNE1vbHBkMnFmLVU5Vmc5Z09Oc1hxRTBvbkl6djhkUkx4MkN0Y2lKc0d4X0E1bWtOaVR4aHRBSFZEVjdJUjI4Mlk?oc=5,Reuters,supply,crude oil exports,1,False
2016-03-15,Weak U.S. retail sales highlight risks to economic outlook,Weak U.S. retail sales highlight risks to economic outlook Reuters,https://news.google.com/rss/articles/CBMisgFBVV95cUxOTExud21zRDF3dEtnaTBzZ05yVHpjbXRoZWFsb1U3RUt5MEpMei15dm5Qbmd2VVVjUUpKTmRST1QtMHM4ZHJjZWxJODVfQmFfZTlISzV6Mm1VSUxWNV9OSjNpcmFYQjFXbUVSLTRlRlhYRm5ZU0lmMlExcFpuMzk3SEk3Z3NlVDFZdTEwLUJnYXFBVGQwTUp0V3QtcnUzWUtJbGNDbnYxRFE1NnowbFhPbV9R?oc=5,Reuters,supply,oil inventory,0,True
2016-03-14,Obama concerned about Venezuela's struggling economy,Obama concerned about Venezuela's struggling economy Reuters,https://news.google.com/rss/articles/CBMipwFBVV95cUxObmNjTjlqN0x2a09OLVQ3blN1VXhHSE51ZGE2UzVfakhBUWphLVRRQUtJQkczQTZwQzJKYkZsM0NfeVZCY1ZvMW4wdGFYUndvYkFjNTh5TTlaSlJDOHFMbF9JX2Ztd0ttamRXWWRCcmhYaDNNSjAwU1NBaENMd0RyNVl4QTBUV0g5V3BvSldQQXIxbHhVWjJ0QmY4TnZJX1RpQW80cUpiUQ?oc=5,Reuters,supply,OPEC production,0,True
2016-03-14,Special Report: The final days and deals of Aubrey McClendon,Special Report: The final days and deals of Aubrey McClendon Reuters,https://news.google.com/rss/articles/CBMisgFBVV95cUxPYmRITjUzalJyNWUycTFzSTZxZFhnMEF5ODhTdmFBSEI0ai1PWEdyNFBiWTcyNE9pR1pMdzRPeVJfZkNNTFROUWx1TWpDY1NPY3A3MXBxRmQ4c3FlWjhYWHJYVjJHMzFfck1IcnB0cDc3RjJIWk90QTdUbnMxVm9LZVBsSGNtLXVMWEhfZ0tRWDAtUFgtUkk5NURLdjAwYmZtMHhndjBYa3VPVUs0b21KdURR?oc=5,Reuters,supply,US shale oil production,0,True
2016-03-04,Landmark Pakistan women's protection bill challenged in sharia court,Landmark Pakistan women's protection bill challenged in sharia court Reuters,https://news.google.com/rss/articles/CBMivAFBVV95cUxQN0x4Z0RmNFBvQVBoaTZfR0xKY1BHQ1F2UlhIZUdrQmRfeW5iM3NMVHZoNVVQNDdOZk9LbmtLaXBVVzVDcE1uQ0hDR2FKRzRWWGphMjFCbTRuTllPN2daVmpJS3ByNFlQM0EtbmZaOUYyeXFTcEZ2Z3Jkb1BzS3BtWGppdGVsaE50RmJWYTBLdGwxYkRvWXhuNjR1LUE0YVdvWGFCLXp5NFdfWWxYNVpsMmYxWGhfZnFhTFo3Tg?oc=5,Reuters,supply,crude oil exports,0,True
2016-03-04,"Japan to revise down fourth-quarter GDP to 1.5 percent contraction, outlook weak","Japan to revise down fourth-quarter GDP to 1.5 percent contraction, outlook weak Reuters",https://news.google.com/rss/articles/CBMizwFBVV95cUxNQnU0RzlfaklFTEhxMngxLW9qYTVMQldNZjM3ZC16OTZZeGlNRUxsQTJWQkxLeW5mNm5zLVdjYUExZXJqTy1CbjV0VWxMYTkxLVhNQ0N1dVBGT1NNcnI3dlFOWEtQajM2N3pNdkh3cHpZTzBTYjJFUjRYMnlaM2l3Y2xlOHB4djY3cl9PUUk1a0hiQ3BpLVNTWVJGbDhiSi1CcHJaNTAzQjlORjVJeDhWcFdDdWQzNkRUMC1TdDNWdjhqc2dETXFOdGJyUmZ1TFk?oc=5,Reuters,supply,oil inventory,0,True
2016-03-02,U.N. mulls new measures to combat peacekeeper crimes,U.N. mulls new measures to combat peacekeeper crimes Reuters,https://news.google.com/rss/articles/CBMipgFBVV95cUxQTEU1bjh4eHF6aWp6cGNsQ08zeGRSdFZ0Ry1fWHczMkcyaXV4ZjlobVdmSWdfZGRLaVRrLWxFMkFRTWV0ZEJBZG1Tc1JLX3h0VUxqM0hTU0VjeU9rSzh6S1M0RXpsQWZnNGJjeUxDX3h4NUl3bXNQeGx2VVN5WjNMWF9jWDJnRzRKMlhrVnRFaERVXzNzcTdjRGtiS3F2SV9PYTFjM3lB?oc=5,Reuters,supply,crude oil exports,0,True
2016-03-01,Sinpas REIT 2015 net result turns to loss of 52.2 million lira,Sinpas REIT 2015 net result turns to loss of 52.2 million lira Reuters,https://news.google.com/rss/articles/CBMitwFBVV95cUxPQjFIVnZxaTlLYjI3ckVVLXgyTHppNTlGamliNW1HQTFfc3hXMnhTUndaalQweFh4RTJ0dU41MUtFdFhNYWxCTUFZa3BwU0xHUVgxN25mRkh5U0RyNWFoUlYxZXZuSzY4TTlqVnZZNllfOC1zbDhLZ1VGR2VXUmhZMFBZN0NSZUNBMFFlRjlJMVgwM3lDU3Iya2VXblJQekxDQ0I2ZkloNy13cTV3Nm9RZEVKMnVZSG8?oc=5,Reuters,supply,oil inventory,0,True
2016-02-28,Reformist gains in Iran elections clear way for business boom,Reformist gains in Iran elections clear way for business boom Reuters,https://news.google.com/rss/articles/CBMizgFBVV95cUxNdmRySlNVMkJLbDB1YXdhQjVxNWFHNEVtTHlrdWNYb3ZPcjFjay1KWUNIblRnRFFnd0hRd2VNWHR1VHdkQU5tMjMtTjIyd1Fha3BvMlRITjMyN3IyTXA4dTBBRkNaemlYWUUzeE5RdWdtYXFTQTFZMnppSERHT0tRcHF4X0ZUQ2FsUWZ0S0pfeDRQMGc4cU93TnRvVUZWdnl6a1dHMmI2SGoxNjRnUk9OQXM1M2llbHc0MWR0aTdLMWR3WnFvRFdoanUwVUl1dw?oc=5,Reuters,supply,OPEC production,0,True
2016-02-27,Deepening default fears cast shadow over Venezuela's oil flows,Deepening default fears cast shadow over Venezuela's oil flows Reuters,https://news.google.com/rss/articles/CBMiuAFBVV95cUxQRzBUMkFCZ2p6YlVMb1VQMkJDa2FKUm9FMnZnUGg3NGJkSUVBeEltMXNLcVJkT1ZFU2pyNVR5X1hXd2FRekxhZzY3bU5YcENyT0tISlFRaVNGaWp5VUNUenBIT0dlX1dZeGtqRGhHZnEzTkRicFRtVHNodm1Ia1U3cm1NY0lVLXAxNzJadFY1SFhFXzN0dXA2N3dkckwzSzlxUzBZblprNWZzSmp1cF9IYlgtdm13d1FG?oc=5,Reuters,supply,OPEC production,1,False
2016-02-26,Bosnia eyes closure of radical Islamic centres over links to Syria militants,Bosnia eyes closure of radical Islamic centres over links to Syria militants Reuters,https://news.google.com/rss/articles/CBMiyAFBVV95cUxPanUxT2F2X2NUR0htR2JId25tcGRvNWNuWVlnWWZkbVBoU252d0h0MVZkRHZDQ0hrWGVTQ2lGNi1XU3NpbE5jQld2YWcway1FUFR4bGhSTV9ITnM3dGF4WjdYTkpFMXJkRFN0LVNxUXQ1QUkzbFY4b1JHcFFpSWhfT3NCWTVocVZoRkJ6MmVTWTRadEJYd2dDV0dqOUlmMFVSQlU5aVl5aG9hTi1MNnhWNldjMG9mTEJFaTV6TF9pYUUwczhjVHJJWg?oc=5,Reuters,supply,crude oil exports,0,True
2016-02-22,"Veterans of 1980s oil glut say this price slump, too, will last","Veterans of 1980s oil glut say this price slump, too, will last Reuters",https://news.google.com/rss/articles/CBMiuAFBVV95cUxOWEZhcVo0SXdqWTRXVkhPcUdSWUNGS2gtNTNFaGhKMGdlWDVoY1pWdEFNZkwtQ3h1WTNCYW9MdkxvUnlwOTdfS3ZKSXRDdmN1Z3l5V0J5Uy0tbDh6dk84RzlPQ1pReGRURE9oaUNnZEhzcV9HTEh4YmJtZVZuRGlTTTQ0TXhDd1o5NVFia1BRVUJWd1VJMVdMNkRNZEphQU11dkFqX0FKYV85TFpYOVpVZEg0T0w2eDFn?oc=5,Reuters,supply,OPEC production,1,False
2016-02-21,U.S. official doubts success of deal to freeze oil output,U.S. official doubts success of deal to freeze oil output Reuters,https://news.google.com/rss/articles/CBMisAFBVV95cUxPQk5ZaXNMX3VJbU14ZG0yMHVBem11Z1FHS1VKZkp3VU04YXQ1ZmlQVkx2MHFta3JmeGlRdmxTRGVBdVZnbW5LOGt0VTRDOUw0MW9BdVFoQUR5ZnN6Vnh0WkZTdnJ6OUVMVDBIZlZzQjgwd21lNUVERjJBclo5by1HZ0l2cUt1WHFrcFZRUXJLUFhSbDhjM29zd1hSSFRFS3VXTXA3Y0FVaG1naFBpSFVJQg?oc=5,Reuters,supply,OPEC production,2,False
2016-02-19,"BUZZ-U.S. STOCKS ON THE MOVE-Southwestern Energy, Encana, Trinity Inds","BUZZ-U.S. STOCKS ON THE MOVE-Southwestern Energy, Encana, Trinity Inds Reuters",https://news.google.com/rss/articles/CBMie0FVX3lxTFB2WWNDMnJPdnNSVHJBOElLaGFJd25NVnlyXy1idXVaeU1wUmFtVVNlWWtfczZEVXVqaTdTRGFpOHNvN1lZUHY0T19nMmJRcnR4cWpmVmJQSFhERG1nV0hiNzNObVJqeElPQWhFTVg2S2Vma05lNk9aSjN6VQ?oc=5,Reuters,supply,oil inventory,0,True
2016-02-17,Fall from grace: Philippines' Manny Pacquiao faces vote boycott for anti-gay comments,Fall from grace: Philippines' Manny Pacquiao faces vote boycott for anti-gay comments Reuters,https://news.google.com/rss/articles/CBMiywFBVV95cUxPWm1vRmlUSEttSnI4bDRicEVnOEQyY1NHeVJ6S1BfSExHWUpocFAyeWxOSkNpUWFaMi1xNXd0UkgxVkQtOXFUcTdLcnVicUlPOVZTUngwRGJYRmxxOTlOcVhleWlwOWt3MnQyRzFfcXI2UEhMSzZMR2VaR3V5TGhIQU9EUnp1cGNOSTRyWE4xNFRWaFBQNnZTbWVFTVdUUjNxanNBbVZibmZNU3VQNnlXOGlvZUxwcVNQd1ZjUFJnbjdBLXJWRFdhT3dUWQ?oc=5,Reuters,supply,crude oil exports,0,True
2016-02-17,Iranian banks reconnected to SWIFT network after four-year hiatus,Iranian banks reconnected to SWIFT network after four-year hiatus Reuters,https://news.google.com/rss/articles/CBMivgFBVV95cUxPUHpNd3psUjA4RVFwY1hXUTliNk5uMFpRekhXV3V5dnlqOHc2RFNWZmF5S2thN2xHTzYwMS11TDVya3YzSERkZVF5UmpRZ1VEWEUyLVlQM0FFNUxhLWJ5MThPcUlRY1c4UU9jb3o5X2plSGMwM253ejFpVFlRQ0R0Y0l3Q0hzQ2VxTTVSNUk5Z3BSdWhVUHUwM2JpX1R2MUE1UEJiQnJMVWNWczFPcG5pN1VwV203WVVGaG9ORTR3?oc=5,Reuters,supply,crude oil exports,0,True
2016-02-05,Special Report - Why Obama and other gun control advocates own stock in firearms makers,Special Report - Why Obama and other gun control advocates own stock in firearms makers Reuters,https://news.google.com/rss/articles/CBMiywFBVV95cUxQUFJXc1VNUDJpbmxSX182c0R1SFJVTnlkeGRuc0tQbjBYSGNXT3FjTmlReXEzM2hhbnprRW5UZzJ5b2ZZenVsazU5aXVWMkg5U3Ruem1qZWV2a2RNNmczZE1hVjMxcXRVNW93aEY2NVFNeExBcm9wb1pfRHVId3dKalVuYmllSUtVQlVaNkZRazZSb2ItWFlBWHUtaklxVVoxazUwajBWUWg0YnpVOEdPYWd3U1FFSlAydWtXb2ZKM2IxVFVNNTFsTWppSQ?oc=5,Reuters,supply,oil inventory,0,True
2016-02-05,"Zika found in saliva, urine in Brazil; U.S. offers sex advice","Zika found in saliva, urine in Brazil; U.S. offers sex advice Reuters",https://news.google.com/rss/articles/CBMirwFBVV95cUxNa3lGdTdKb1RGNmFCUVdsdEhJVzV0TVE1TkxHV0ZNQWZuN29kakdrcFExLWw0eWJMNzBVRUxtUW8telJ1ZVBLcW5LUHpabzhFQ0VUbEE1SnJiZHk0OFBRdXhMYlI4QzRLN045THhWX09DT2FPRHVXZzl3dndFSWlZcjBxNXV4ZEI3R1pqRDJBNmJHd0o2S0dyZFVDdkRfWnhxOWhWUWRmUWZzQlpMYkFJ?oc=5,Reuters,supply,crude oil exports,0,True
2016-02-05,Exclusive: Iran wants euro payment for new and outstanding oil sales - source,Exclusive: Iran wants euro payment for new and outstanding oil sales - source Reuters,https://news.google.com/rss/articles/CBMi1wFBVV95cUxQeEFpNXZvQlYyTmhUb25xREpHeEI2UTA3NGdRQUQ5cmV1NmN1aHhvM0hWdU13N0ZzMGc1MzhQaFAtT2VxZU9LZXpXcndVTElSUm02M1RsVnMwa3otTEVveW01b2hVS2xqY1pjYlI4RVl4Z2RyNE04V2RfOFhEVlA2V01QazJLeTBBTXZsQnFvckNiNHhmOE5pOG5pejdlZHJya3FlZVhWZHg4MDhRdUlONlpjTXhpQ1UtOGJfNl8wNUxRZkUzM0V2SmhDdDlsZElhay1SVVJtSQ?oc=5,Reuters,supply,OPEC production,1,False
2016-02-04,Saudi currency devaluation would carry major political risk,Saudi currency devaluation would carry major political risk Reuters,https://news.google.com/rss/articles/CBMisgFBVV95cUxOajRUZzRmcUEzc2R1cnJEcWx4WWVkNS1pcU1hY0QxU0w3QzhKcThETTFjX0dXSWI1TFF4NUwzMEFDSkk0bkRPSm9VM1UzR25CdkJVY2NiSW9wQ2RXX3E2Tllwc003MWducm82cGtDQjEtWFlKbjk2Nk96UklHdkVXTUpKZllsRXVmNW5IMk5WX01kZlBTeU1QTnQyN3g1cm1Pa2NFU3N3djB5cnR1ZEluR2Jn?oc=5,Reuters,supply,crude oil exports,0,True
2016-02-03,Algerian court jails six in oil firm corruption case,Algerian court jails six in oil firm corruption case Reuters,https://news.google.com/rss/articles/CBMiqAFBVV95cUxQblZkVXlERUtZZFZtSDhTcDVzZjFHTU5INlR4WTNiZWg3V181Uk1rOVAwQTA2SEVqVXBSOENTRzROMnBfRi1aRVVSeXBDWnh1ZWFZeHVzc3E2THdiWWVQWnhfcEZsLUFxam5mcGh6eU9DN0VPekxic3JWemx2YnJERHE5b2RfQ0RLdy1EVFdTYmk0alk3ZFh0QVh0RjB0dlBrOWhMcmZoUjk?oc=5,Reuters,supply,crude oil exports,2,False
2016-01-31,China Jan factory activity falls at fastest pace since 2012 - official PMI,China Jan factory activity falls at fastest pace since 2012 - official PMI Reuters,https://news.google.com/rss/articles/CBMixwFBVV95cUxQU2VHemk3MWR3TENVZVY2bldhQlljVzEzSDFYcGpxTEtWU3pFelo4N1hjT1pKVUZpaG0xTFRpQjU4UThfYWM3M1lsN0xqN3BpOUxXRVYyeFQxNGNGcUFlQmNCQkZIbHRmRFY5VzFRblNZeGRRcUpxaktoNkt6cHVOcUNDRFpmQlljc3RFS0lhd0lXc1dSb2dXcG1yT3pfdFFTOXRkamZYWVBVcWhVZUxfX21jd0RieG9mdmVIWGc5QlZvUnYtemtr?oc=5,Reuters,supply,oil drilling activity,1,False
2016-01-25,"Hyundai fourth-quarter profit slips as U.S. discounts, emerging market slowdown bite","Hyundai fourth-quarter profit slips as U.S. discounts, emerging market slowdown bite Reuters",https://news.google.com/rss/articles/CBMizAFBVV95cUxOUVhRanJZRDZFZWJ0V09KSHhvSUw1aXlUSkd0YnlZMUFzZUtCUUdEWDR5LU03emY4UllmZlRkQ0p3WEYtNnV1RlVtcl9GYkRuTkhkMWQ5cmMxNGx5Uzc2M1JSTS1Xb3VPRnpINlU4Y0xyaDVnWmQ1UEJkaElXaXFYSG9pQjhqVFVtWlg2R3lCdzdfVVJudF9OdlNnalh6a0ZVYjloUElkeXI2aC10WDA5cTlQamJVaGx4R3FZMi1OV2NQZlBvVzZpLXdrRTE?oc=5,Reuters,supply,oil inventory,0,True
2016-01-22,S&P may cut oil countries' ratings to reflect 'new reality',S&P may cut oil countries' ratings to reflect 'new reality' Reuters,https://news.google.com/rss/articles/CBMisAFBVV95cUxQZVc5TXdDZl8zc0x0dTNwZzBEN2RYWkJXRk9tSnRrWFJGS3pVbk1EekdYRDBnWEptbUVLaHNjSlF4SUU5YWhRZHJjNXl1UzNaajZ2bWljTXNaQ0tOLS1kRlJEeWFOcjdBaU9kdE9ZUTBRLXRZNUllQ2dVdFJWZUFHdmp1VjBUSU5zeWZCTV9meVByV1dlNHM1X1F6WkRpLXR0YV9LMU1tZVdobHVhdjdCNA?oc=5,Reuters,supply,OPEC production,1,False
2016-01-21,"China's Xi visits Egypt, offers financial, political support","China's Xi visits Egypt, offers financial, political support Reuters",https://news.google.com/rss/articles/CBMirwFBVV95cUxNaHJiOE56cVFwZXFfWHZDdWwtUk5NeU1sdkl2SEh4S0V2c3BCQVpIdjJTY0ZHbXdhRGZJNGI2ckpWVmhwYktyb1cxRnFXOHFSc1RuOVlWZlRFNHJNVTBwMEF2YjB3M3podURoMTl1cjdkdGhDMGhXYlFXZWpsUVFhdlE2VkhwSDA4QnNVcHg2ejJiRTVReWdsVTRfUGV1VUxnZzN4NkNJc1hXbDQtX284?oc=5,Reuters,supply,OPEC production,0,True
2016-01-20,"Even in slump, U.S. oilfield firms hesitate over post-sanctions Iran","Even in slump, U.S. oilfield firms hesitate over post-sanctions Iran Reuters",https://news.google.com/rss/articles/CBMizAFBVV95cUxOTnVHV3BHcnNhRUJqeUdhUzVYeGgwSlU1a0oyTmM1dWV0ZDZPNFlPQlRDNXU2XzBRQWlJanFYN0owZnBNdXV6bHJia25xWlRuM1ZaT0QtZEQwMTJaODRVUjZCeDhvTksxXzhTSzVGM0JrSGhPeGNQS3VEMDU2ZjdnME55R2xGSXFSUXVtcFdxOHU4UUNlUkZUMmYyRHNDOTIyMUtiekI3MHBabmwxbGNwdzk3STU4VHJfaFhraGNoVTJiZ1pzSGd2NHFnSW4?oc=5,Reuters,supply,OPEC production,1,False
2016-01-20,CORRECTED-Nikkei tumbles to fresh 14-1/2 month low amid oil rout,CORRECTED-Nikkei tumbles to fresh 14-1/2 month low amid oil rout Reuters,https://news.google.com/rss/articles/CBMiugFBVV95cUxNOEhPazNjZTk0TWUtaU10bms4VExmbHlEQWFnejYxNWQ3VVhRTXU0Z3ZLRG9UN1Jubmxlc1Y4bDlJLUt6Y0dlWVdBWmNWbGNjRmVqb0gyQ1RGQUhnclBBN1ZNa185dmFWZGVCUjFGVXFIcGpnVjR6bUxRRkxDaE1OQWVFamIyS1VkQ1J6dkwzVDU4dU1Sckg0M2ZEWWNtcHFHQmVuZnpSc0VyNzVfUE4wNklWOC12U3RsRkE?oc=5,Reuters,supply,US shale oil production,2,False
