date,headline,summary,url,source,category,keyword,oil_relevance,is_noise
2018-12-31,"Stocks pin hopes on Sino-U.S. talk, as year ends deep in the red","Stocks pin hopes on Sino-U.S. talk, as year ends deep in the red Reuters",https://news.google.com/rss/articles/CBMixwFBVV95cUxPbnlGU3pqTE5rZGt1ZEhnX2dscEloaVlTc1M4Z1NqUVRSN1ZWcDV6RTd2T1ZmRnl5d3hQcUFGeVNjdEpDVy1aSk1IV01XcHpycy1fWVBBRXdJelM0VTRLbjh2dGdFeHdmeUFITVduTUhtbzltVmhONEJsTXhWT1pFVktpOEl0UjVSY3BmVnRfN0VGMm9QbGVzSmpmVVVzUzR0VE1iOWZGeUdBb3lOb2NfcWxFTkduMWVVV210WXdvUUM3ZklyMGVj?oc=5,Reuters,supply,crude oil exports,0,True
2018-12-31,Thousands brave rain in New York's Times Square to welcome 2019,Thousands brave rain in New York's Times Square to welcome 2019 Reuters,https://news.google.com/rss/articles/CBMitgFBVV95cUxQaFY2NHhPSGFwNTI1MEl0UXlSOXZFeGhiNmVLOXRuaFdTUXBDb1g4TlpDYmRMcTd1YWttTzFaUV8teG85YV9GSHc2Uk5QVkRQM3B6cFFBa01CTkFuNmw0d0hzZ25mbm0xZUJRdFRwVXY0SlZXVkFfMkd1UGxkYU5jU1gzZHQ3VF9hYTJLTVo1M2lCdzQwbEZwcmJYWHBNNWg1UGJyTDhQdmozOVJDLVRCeVFxR2ZUdw?oc=5,Reuters,supply,crude oil exports,0,True
2018-12-28,Asia's Iran crude imports hit more than five-year low in November as sanctions bite,Asia's Iran crude imports hit more than five-year low in November as sanctions bite Reuters,https://news.google.com/rss/articles/CBMizAFBVV95cUxNMmpQOHNQdng0aVNHS2ZDVW9fWmszQVRwZERCSEF5ZmY3TDdXdFJDbmRFWDQ5blRmdnpVdTd2OEkyS0VMcnpIcTVpVVN4LWlHQy1ha29WVEdCdWxTRFlrUDRBRUZadmFucGxwcmY5ZEgyeXhXN1llT3FueThCaW9iNk5LQWd2VWVXVHV5Y0RqQnd0Yy1aUUpYUWVXRWhnZFVPRjdQQXZveFRpdk1BVWNSQWRPbkRjbGVpY0NLV0ZaRXBLdXdjZlZsYWdFUGY?oc=5,Reuters,supply,OPEC production,1,False
2018-12-28,Spanish coal miners work last shifts before mines shuttered,Spanish coal miners work last shifts before mines shuttered Reuters,https://news.google.com/rss/articles/CBMivwFBVV95cUxNTVozV3g2dTRDZFdDRFZ4bklGVE1wVkhwUExHNjJmR2tBTWJpX1VtREtyU1lTbWRvR3dQYUZncEJ3YmRIZVlVaWJWWERDakxLZGQ2QVpwc2hYUnpwNDZkYTMwdngyNzlwSHluZ1NZaHVpdmU3RjlzQUhfeGtqYkhhdzlUQ1hZV3NMOVphX1lEZi11alJQMzhEUkYxTlJuN1FmeFVjQUdvMU9Yc3R5T25QVmFNNi1NeENwODVRd1A4TQ?oc=5,Reuters,supply,OPEC production,0,True
2018-12-25,Russia's energy minister sees oil prices stabilizing in first-half 2019,Russia's energy minister sees oil prices stabilizing in first-half 2019 Reuters,https://news.google.com/rss/articles/CBMixAFBVV95cUxQdXM5UG16V3RuTUVWMWxyWmNMdWJZeXAwVnEtcjRFclM5OUk1U1p3U29jTkNqZDJmWUJ3RkExVEhZU0IwLW5GUUdIa0NHWGwzMkttdC1DTWt4NFJjOFlqUWp5MjN1V0kwbmNpRHRHREY1OVZ0Q2owS0YtRnF0RjR0bnhDZWJIdUJiY2Z2SU1KLXItN2ZmUGh3dlIzZW52WHJjSUo3NEtxVU5MREc4MURLS3RkLURhLTBMaXQtTmpSR3JpN0tk?oc=5,Reuters,supply,OPEC production,1,False
2018-12-23,Venezuela navy confronts Exxon oil ship in Guyana border dispute,Venezuela navy confronts Exxon oil ship in Guyana border dispute Reuters,https://news.google.com/rss/articles/CBMiuAFBVV95cUxNazlGNkpqOWc0Mm9iT0hoYjExQkNONElKa2ZOV0wwdXdpdndkOS0wd2I0Rk9GNkhKZ2tndU5pbGF4Tk9TWFZNXzlwTlQzOXZZSDcyUEJBeFlWMXUya3VXMFZMQlRzUXNtSFlRZE40U0o1djEteU1GNUEzdndjV3FrUjRUN2lfanBaY3FUc0x0c0lEVjJmbWJETTJ0QmZvclZKMUV3LXBUOEtjRmc0TlVnc0o3NXZUSTdU?oc=5,Reuters,supply,OPEC production,1,False
2018-12-23,NZ's Infratil to sell local bus business,NZ's Infratil to sell local bus business Reuters,https://news.google.com/rss/articles/CBMimgFBVV95cUxONFV2dFZzOUJILWVMRy1Nb19ySkd6ZnR6Z0lmckozSFRRRUFGUVBfZldJRzVxcUtRRXZNZVgyRWQ0aG1VRWFBbmg3RGVmdGxreEo2dkhWczdZT0lscGNQZHZwbl81YnRJRUZldXN6a01rTWtXbjdDdHBrWml0dzRjS1BpZzNJNE53V2tfYzBtVTFPbDRHNGJ4UGN3?oc=5,Reuters,supply,oil inventory,0,True
2018-12-21,U.S. shale producers hit the brakes on 2019 spending,U.S. shale producers hit the brakes on 2019 spending Reuters,https://news.google.com/rss/articles/CBMiqgFBVV95cUxPWnNRbWR1d2VJNlBZaTluS3FFWm1fSHhWTnItUVlaa0JVMlk1RXpRTlNfZTlhRDhWOUsxcW44UDVkb3BVcUtNVGVpT0liclRmdE9xV1N5bGlqZG1CSFlwNXQyV0xreHFPb3l6N3ZIMlA1TTdGVERoUHhZUDlZbzJnWFl3YTZwVUx4Yl9iU0NSRWM0REhVZ05MSGpzaHlzT3lpamJjVDF6ZVlsUQ?oc=5,Reuters,supply,US shale oil production,3,False
2018-12-19,BP launches $3 billion sale of U.S. onshore assets to fund BHP deal - sources,BP launches $3 billion sale of U.S. onshore assets to fund BHP deal - sources Reuters,https://news.google.com/rss/articles/CBMixwFBVV95cUxOVUhpdzJWQV9IOU1JYXdNcDJucmRzeGM1dGo2WGNZbDZSV2NyenNpNFY1TEY1ZnJRaGxzaHVQamVGS3d6eUs0Mnp6LXY0MmtDVjBQOUl5aUVQbU1HMEtJNzhaLXUxbEU0V0NSQVRMRnRqZERMdW1fMTlIcTNIYXJmTldGXzJ1MW5CaEk4RFNJU1F1TC1TZlVHRWNvOTNyc0JyZnAyNE91OXN5WjdraHJkRWdHUDUxbUtBTk9hSk9GUWMxOFZmdVl3?oc=5,Reuters,supply,US shale oil production,0,True
2018-12-19,Exclusive: U.S. to offer 'black box' nuclear waste tech to other nations,Exclusive: U.S. to offer 'black box' nuclear waste tech to other nations Reuters,https://news.google.com/rss/articles/CBMivAFBVV95cUxNWUJ1NlRiQVNVb2lDcTI1RXVIVGp6WWQtRkd2ZDFadFZOc013dUpLTjlYcjVTVWNlbi1TU1kxbGZ2S1h2YnRtYWxxYTZTbnFKVnQ3cTVDeE9Jclc2M0JpdHVoaW9xaU9EaWlQSWpENm5XLWl3WVZmaDRUVmkteWZjQ1pRRFRvU0FKcU5md2hXaGt2U01pcDhiM2NLOGRtTjA0LTRmT2Q0WDF5MUctRHhxd2xSeGpmS3RpbUpmSQ?oc=5,Reuters,supply,oil inventory,0,True
2018-12-13,"PTTEP wins Erawan, Bongkot petroleum blocks in Gulf of Thailand","PTTEP wins Erawan, Bongkot petroleum blocks in Gulf of Thailand Reuters",https://news.google.com/rss/articles/CBMiwwFBVV95cUxPZkxCUzVJRXdFODVjQ3d4Z1g0dVVQWmwtVDg1YmxYQ3doZFVhUHpLLXFpS01fLWwtbzUyQzlrU1EtWHNpVGJDVUZNMWNGWDd5UUlMbC1xcWJxa3JVdmJDLXdGM1lndWVRbi1oMHI0THNucUp2RzFOVGF2RHpURC1xbjBiZnBvenRXckR4UjJERElCekRMLW9JZldfeVI5MmFKNzdNbi1SLUtINzgzUHFEU1J0RFdNUEFxRzNiT2FBNnhNM0k?oc=5,Reuters,supply,crude oil exports,1,False
2018-12-12,Soybeans rise for second day as Trump says China buying U.S. supplies,Soybeans rise for second day as Trump says China buying U.S. supplies Reuters,https://news.google.com/rss/articles/CBMiX0FVX3lxTFBLeF9vaTk5TEpoeGFEWVFJMThqVmRMSWZqdGhOMFFqdnB6eTBUa2VxdWdNdVJZZUluMEpzWHF5Zi1uTjQ2dDhmcExQRHVtLTJhS2tOcjNOQ3J0bXA2MktN?oc=5,Reuters,supply,crude oil exports,0,True
2018-12-11,One killed in Venezuela illegal mining clash - defence minister,One killed in Venezuela illegal mining clash - defence minister Reuters,https://news.google.com/rss/articles/CBMitAFBVV95cUxOMTh3RkY1eU1HbWt5THhGal8xZkMySjNEbGFJeUozdEo5MXY3b0R3RC1WOFViTjVma1k5eVlmeXA4M1BVbXVCcmN5Q1ZVc3NJVXdaS3NlSUlQbFQ3cE1hbW5RVXpVREtYMTBOemM5MDdvQUNmby1lZlBEbFYxTWdNM2Fkb1pMLVdOT1FXeDNZVDB6OFFHaVUyNUJ0dW83YllPLU5hbVBKR3VOM0FLUmM0QldJWi0?oc=5,Reuters,supply,OPEC production,0,True
2018-12-11,"Australia shares end firmer as U.S.-China tensions ease, NZ up","Australia shares end firmer as U.S.-China tensions ease, NZ up Reuters",https://news.google.com/rss/articles/CBMiuAFBVV95cUxPVEdIb2FsU293QTZMMUFNWjhobkpYeXJ0eUV1bkVjOXNOdGFQUlBsVWtRTVhFZHlzczlMVnlvQlNfeXlCTG43alJISEN5b1J3b1l3THoxVGlzS2dXRDBVUkpkdy1VQWl4d3lqTWVYNkc0UDFYb2h0d1RyUFA2by1jQm9mUTNsN1E4eVNtUlk1anNvR3lnc1BEcXQ4aTJJSTdyZlJIV1NhNUVCNENmaU5Yb2dNZUtLRml1?oc=5,Reuters,supply,crude oil exports,-1,True
2018-12-11,Turkey says in talks with U.N. about Khashoggi investigation,Turkey says in talks with U.N. about Khashoggi investigation Reuters,https://news.google.com/rss/articles/CBMisAFBVV95cUxPODBheTd2ZjlXSjQ3UnZBMk9MX2VZVXNnTDhNX2pzUTlwQUlTZVJZanVmRzQ5UmNhVEpObUE4Ykt1UUFSbEc4VFNpa3J3aURDaTE1enlQSWFreGpYc3hBSFY1UGxGa2l4QnNzWnBoN0F4Z29JTVl3Qmg5SjhRRHVJSEIyQURrTDl3YV9fU014VmNNM0RlWllSTXY1bWctbnNVeDJIZG5zdHd2b21raEZUVA?oc=5,Reuters,supply,crude oil exports,0,True
2018-12-07,China's Iran oil imports to rebound in December as buyers use U.S. waivers,China's Iran oil imports to rebound in December as buyers use U.S. waivers Reuters,https://news.google.com/rss/articles/CBMixgFBVV95cUxPY3RTSlZxRVdDRXhodmxBQ0NLNW1kUC1rMl9WMG9yWURBVDF2dFFaZXBhemEzQl8ybGQ5Q181eVZuNk9pYmgxWjg4aFprUVlUX2hlZjA4amVGVHBuazhVNDJRN01tbV8tZzNaVnlWR0NiOHE3ci0xdTRkSjBYa0kySGZMQlptX21LWVJ0UkM4V19Ld3BCTUh2aV9mQjZmRlUwT3V0VGJpUzhpYVlpc0Jfb1MzY0JPalpnbWJLcUp3ZzVsZFczS2c?oc=5,Reuters,supply,OPEC production,1,False
2018-12-06,India to import Iranian oil using rupee payment mechanism: source,India to import Iranian oil using rupee payment mechanism: source Reuters,https://news.google.com/rss/articles/CBMiuAFBVV95cUxOMUpyWHE3QWdmUTA2TnpJNzVSUDl4TG15Z01kdk1pcWFnanNoS254TUxIZnJmZjl4eC1FeGY3d0lFSTZURXpkekl0N3hWc0FaRWZwNWZRSkNNZVBzRmIwaHR0dnR1NjBCbGJTLUp1MkVEeDdMOXBnUE1lSEZmakpSVWo5WWpEcXFQbTE4S0RCTkdGRjZxTjgyd3I0THNDcFlLM1VaSi1abWJoektqWDlJUmN4YTdNcEFs?oc=5,Reuters,supply,crude oil exports,2,False
2018-12-06,"In major shift, U.S. now exports more oil than it ships in","In major shift, U.S. now exports more oil than it ships in Reuters",https://news.google.com/rss/articles/CBMisAFBVV95cUxQSUJqanYtNFQ5amg4dFFFZTVMV2FaNG1zZk1EUkNDd1d6ZEI0UHBTeWNSWGxaY2c0VzV1YUtmVzh2SUJKWUFVNDRJN1BaV2YtcjdhanhuNmFQdmFkS255MGhJOHZIdGpGb3BMSXRKUlY2ODhzX1BVM2VTTDNYbXYzQU9iNHhfSWlBeTcyc0RHMXYtaXpWbUQza3pxeWFxNmRCNlFMVjJrRzFWdWRTdkZ6eA?oc=5,Reuters,supply,OPEC production,2,False
2018-12-05,Column: U.S. oil reserves rise to record despite production boom - Kemp,Column: U.S. oil reserves rise to record despite production boom - Kemp Reuters,https://news.google.com/rss/articles/CBMivgFBVV95cUxNbnhYMWVuTkRpSGd0QW41UDNfenh6ZGRxRC0zSXdUWHkzYU1hOVdUN20xRXZpOC05WjBCQWl5SWRQMUdLdVY4a3UxTWhLRkZLSndDX29ZUjZGbDRySlJmSXZtNGQxY2xtZ242Tm4tcXhJQ0FaWWpldGx0d3JZeHJheWZqSU9YTS1KMVpYX1lqek1WcDRlVEZMR0JTSXN4bDJOTFJtQ0FScDZfSXBjcnJUMWRLY0xyU0p0eTBFN21R?oc=5,Reuters,supply,US shale oil production,3,False
2018-12-05,"Without gas for cremation, even dying is a struggle in Venezuela","Without gas for cremation, even dying is a struggle in Venezuela Reuters",https://news.google.com/rss/articles/CBMitwFBVV95cUxNdzc0Q245QW5yUnhLOHc4MW9SQ1VSNVdlSll2aERQdlFfWFBIVnRCbGV3YUdsWFNzMUxnc0t5ODV3THNpaGgxMkp5YVdabmFKMUVCOFI1VnVDTERWMkRMcDdxbmo5ak95V09QbVRTQ0NlRWFNempYaWc5bXk2UlRLRGpaVW93UGVEUk8tMzZwNDI5QXU0N0duZzRpZEpjX2lEOHFFbFVqSU4wVjY5Z1JQeVRqM0JsWUE?oc=5,Reuters,supply,crude oil exports,0,True
2018-12-04,Volkswagen says last generation of combustion engines to be launched in 2026,Volkswagen says last generation of combustion engines to be launched in 2026 Reuters,https://news.google.com/rss/articles/CBMizAFBVV95cUxPa1dtT1ZxUmJodUFoM1JQcUlaV2RLbEhkMGhJWTBSY1k2TkhPeGoyRGVQUmRwUDhnaUxZUHFLLWllbnZhbkpfNDM4YS1EOTBWSmYwUi1jY2lyMDBQLUV2aURCUm5uM1BUaGN3a1NFMlVNZFBZWFJ5MzFJalZ5c3pfTklHT1VpU2R5cUt6ZHROOWE4QVFOdjJFM2Z3VmdJYjloZmN6UEdIczBtM2hSOEFxSWhIOUdnNUlEUDZfZ2pubVh6UUFKVFNYSEJZSUE?oc=5,Reuters,supply,OPEC production,0,True
2018-12-04,India's strong domestic demand takes November services growth to four-month high: PMI,India's strong domestic demand takes November services growth to four-month high: PMI Reuters,https://news.google.com/rss/articles/CBMi0AFBVV95cUxQQ0VQVEhBbTQxLUJQa3ZmbXF3UHpVRzIzLW5pd00taVVWYWU2S0pIeWNCQTZTZVl5VktkZF9OR1lrTnY1Tmd6Mk51U0JJYUVtU1RxbE9jTEd4V1pmTFRnSWJ1V2NiSEZWcDhOR2hSdXlZaWkyWWxZUkpMR0ZJaFpNelYtTEVJODRVTnlmMEp4QW02N2ZiSmhjeFJLbTBib1hHY0pFX2s1R25VbEVwYlI2VC1CRy1fNlpZRXhldmxyQi10OTZOckRHZEFzQjFzY1Y3?oc=5,Reuters,supply,oil drilling activity,0,True
2018-12-03,"Russia's Novak says OPEC, other oil producers to discuss Qatar's OPEC exit","Russia's Novak says OPEC, other oil producers to discuss Qatar's OPEC exit Reuters",https://news.google.com/rss/articles/CBMixgFBVV95cUxOU193UWpZQlJEbTFad3dTSXUzM19KTzYzV3JfZkNhQWppbjVrT2hzNnNIc0NiQ2dKZTRhaVV5VzNwcHdhcUhYbzUwR29YMVNnTHFLWlBVbVJyaTF5b2k3MnFxY0YyUktiaE55TnQwampjM0RxMlFUa0EteENMMEpqUEdoTWdKRkpKbHYtTThoYWRabmx0Ymh0UkYtWmNteVRGaUU1SnlxUXVoWm11T2xsdDFZR1Jyd3lBb3RsaU9PdGlUemQxLVE?oc=5,Reuters,supply,OPEC production,3,False
2018-12-02,PRESS DIGEST - Wall Street Journal - Dec 3,PRESS DIGEST - Wall Street Journal - Dec 3 Reuters,https://news.google.com/rss/articles/CBMiowFBVV95cUxPeVUyUGxUejRVcHpWdGZnZk15VFlCT1RuZDJSYjVneUh4SVZPUG5GU0UxUnlpTFlrZmt3MHZnYktDdVA4aGhERnJFMDVWdWo4bVBuU1JickE3VVV0eFZ0MWtKbDUzeGpqLXd0YWVNc3BGd2lacjZKWF9YdVhwSnVWM3pkbDBZZlM2cWltU3ZySjVEc2E3RnVZcmRaaVhqbGw4UUNv?oc=5,Reuters,supply,OPEC production,0,True
2018-12-02,Qatar to withdraw from OPEC as of Jan 2019 - minister,Qatar to withdraw from OPEC as of Jan 2019 - minister Reuters,https://news.google.com/rss/articles/CBMitAFBVV95cUxNN3NzNDJuMmRBci1oV1NMTVY5dy1SYXFPS1NYX0Z3NmtETWttZmVXZHhhUlJNc1lwdHVUSDV1aFB4Vkw3TEF1V2pKVFhYWXVseFRrTjZ3eE5RU3dHVVdWWGRBdWNVdXpmd2Q0TlBvN0hUWHBZS3lBTmhFT29BdE5KaHpoeTQ0TlA0X2VHR1FWaVEzVDZ2T2l1ZXg1cTZjeFhKX1BPd0VHVzI0RHFCeU5tZEtjVzM?oc=5,Reuters,supply,crude oil exports,2,False
2018-12-01,Bush's single White House term shaped U.S. history for decades,Bush's single White House term shaped U.S. history for decades Reuters,https://news.google.com/rss/articles/CBMisgFBVV95cUxPTkFQWld4LXAtRnFnbk93b2ItNEhNYmpSQ3ZBNnEtRXFEdEx6LTk4aFdmWUFBeDFVS1RVS2h2bTQwVTBLdEsxZ09CaDFacDh3WDR1WVVXX3JDbVg0bGNPMmJGSmdYQ2RyZ04yU3NBb2RZTzVfSUJlR1FiLV9rYnJmSTlWb28yTEtKTFU0czRRcVhtc2c2dEMtZEZQWFJfbUVNcnA5TDNYQVgtZmFTS0xPdnNn?oc=5,Reuters,supply,oil drilling activity,0,True
2018-11-30,Spoils of trade war: Argentina loads up on cheap U.S. soybeans,Spoils of trade war: Argentina loads up on cheap U.S. soybeans Reuters,https://news.google.com/rss/articles/CBMitgFBVV95cUxQaGE2dHI2VERVZHJBWWpFYS1udGJMRGFJTjV0VGNCOGxyRjZLWVNvMVZkalRPQ0RtV1ctajVDLXFYZGdtSHQ3aFFncFlIZmJCdXlJdzBMZFdmVW9FVkZaMmFoZTRYeUxTbzFueW9RbDlNeUxrQ2pBQ1BoWFBJRnlwMG92TVpnOW90YkZVVHpQcUhGNkhnSDdELUJWX090dXBqeUV5TUZEREpPNGRPVTBDN1I2X254QQ?oc=5,Reuters,supply,oil inventory,2,False
2018-11-29,PREVIEW-India's economic growth seen slowing during Modi's run for re-election,PREVIEW-India's economic growth seen slowing during Modi's run for re-election Reuters,https://news.google.com/rss/articles/CBMiywFBVV95cUxOamlaZlVicWQxbEpnT3M4aFJQdHl5akMtcFdMSXNMa0k5N3MzMnFxeXZjNERiOTU3U1RvSU9penotRWxZZkxqVko1NDhhZGFfQzFCaGxOaFh2YWFsbmRfd1VDdWZfdzFDOWcwTFdDQVRjbVVFaXlkMlVrQ2VYVmZhMnNPeTBEb0paUVB6N0FhckozLVYybXpKNUFIS1d2Ykp3ZmVzUzlPYWdXU2ktSmROeTZPSjBJekdUbG9GVWpnYzE1SGxESEt1REZQcw?oc=5,Reuters,supply,US shale oil production,0,True
2018-11-29,Corrected: Play depicts Lebanon as building at risk of collapse,Corrected: Play depicts Lebanon as building at risk of collapse Reuters,https://news.google.com/rss/articles/CBMitgFBVV95cUxPZVNwYzJxVExPXzFsZ2VyZXVkYUtMU3QtcTd0QlBFYXdaYUF1VHZNNWp2OWVEbjB5bjJUWTBPQk9WY3owMDRhTjhkTDZQVHJJRUF0bmtZY3czSW50eVBKWHpKbUhFX3FsRXRYbXhndEVPVUh2MjlSZ2hZRHVrUnN0NWVZYXJmMjVlNWIzY0Jla3hfQ3JGb0RjRVBHVUtlUXc5S3pOU2c5T3FmN2VBQ2Y2MkhBR0hfdw?oc=5,Reuters,supply,crude oil exports,0,True
2018-11-28,"Contender: Saudi Arabia nabs new China oil demand, challenges Russia's top spot","Contender: Saudi Arabia nabs new China oil demand, challenges Russia's top spot Reuters",https://news.google.com/rss/articles/CBMijgJBVV95cUxOVnVpOHJkUFY4ZjVFeGRXUTRmUFhsY0pXdHBpTHhjSklYR25yMXUzNy1SbVE5VEhtbE40RHNvektYWEZkdzFKdjZFOUNyVWZJSExCODBaQUJIbUt3dG5NaHE1X0I1dWFwRHM4dVk4UFRvZldlRVJ1QmNpNENzYTdXWDc2eTNfQnAyWlJYblktSmRsS0RfcExDZkN5UUtaT1BVTFBRYktzZU5QZVphZGZNZW5QZlFGY0poUElvLXZYaFRfSXI5M2FpbFY0b3ZpUXROWWxYa2Q5UEJiWHR1OUdKLUI0dExjXzdZUjRmSGhxSVYxcl9Xak9UZ1RvMXRIMUxtQzY0M0dDeDVXN2Jza1E?oc=5,Reuters,supply,OPEC production,1,False
2018-11-28,Exclusive: Abraaj founder Naqvi pitches last-ditch rescue bid to investors,Exclusive: Abraaj founder Naqvi pitches last-ditch rescue bid to investors Reuters,https://news.google.com/rss/articles/CBMizgFBVV95cUxNOXRrc0ZXUlptZm1rZEJRYUUwLURIcERIYjdBM3J0WHY5SjYwYWRWNlZrcVRXOFRRU0ZlbENWbG9NT0tPbVl1czVJNGkySnRqTE1uTkJObU5EeVVobnYyMkxLOW9KU3RUOF83ODVkbEt0LW1oUnh3a2tlTFlBM2hGbzVmQS1fbm9ka1dqZC1FRHBUZlFoUS15V3JOS0Z2S3pPZXplbEVWa1Q1YXZGRDcyNFZJQWtsOWFrMUhmaXd2MjEwbFJVaHdYOUJudGliQQ?oc=5,Reuters,supply,crude oil exports,0,True
2018-11-28,"Special counsel protection bill stalls in U.S. Senate, Flake starts protest","Special counsel protection bill stalls in U.S. Senate, Flake starts protest Reuters",https://news.google.com/rss/articles/CBMiwwFBVV95cUxNZlNYMm5mLXFFbUhzRUNNUl8tZjVQWlhSMm11NTY1dTZXVWdxbjQ0RjNsM3B4WW5LOTZTZkE0ci1NdFI0V1I5aGhvc29tLUxMQzUycXFPdEVFazlDemxBZ21mZDk0UXppcWJITXk3cFA3T2pUUEhGMTB5T1FDV01mMExBNXZkdnRldHk2Qm9QMlF0UTFpWkRodFlHZWVpcEpEMVR5cTQtbGJhc1NqdWtWNmZJZGFBMjRzYWdtMFk0OExhN1U?oc=5,Reuters,supply,crude oil exports,0,True
2018-11-27,Aluminium producer seeks Q1 premium of $91/T from Japan buyers -sources,Aluminium producer seeks Q1 premium of $91/T from Japan buyers -sources Reuters,https://news.google.com/rss/articles/CBMi0AFBVV95cUxPYU9BZ2FwUjBSSE9Udnd2VGxQQURNZmdsbHJNam00d0w3SHNhN2MwLVhNWlZvQ2xPRmRETlhrLXJiTTVBdVFvTHlsRGk1RmNzMmJuUVI1MUFPNTU3UjRPeDB3N0RCa0JnbHlDeDczVzNpUUlNdFdVLXU5c3AtekFObUxFUWRZWG1xYlVoX1BQRFJGZnRrTTFQV2F2eEV5RlR2T3lHSTI0WTEzSHllaWhuQ3JCOHVJOXhuZ3R0QmVIMjA2WG15bjBxQ3RoeFZIZUYx?oc=5,Reuters,supply,OPEC production,0,True
2018-11-27,UAE's Fujairah oil inventory data for week ended Nov 26,UAE's Fujairah oil inventory data for week ended Nov 26 Reuters,https://news.google.com/rss/articles/CBMirwFBVV95cUxQR2N3ZUFINmRQelFpdjloeGVySmI4SjdEV1FwbUIyLXV4N2F6X0FNV1FaMS1hMVFyRkttb2FZWXdXU2psVEFGM3RQaXJtNDdCYzlqWjhMVEhUUEN5b1NydWNueDdyNTlJckVvTVdVbEJlOTd0ZW1uMUduTnJXb2JMNUV4OHZfZGdTb1lYeVB6NDR1TU95Q1g3Z0ZsYjhoSk5CZEpiUWlIV01tUzlMUnNZ?oc=5,Reuters,supply,oil inventory,3,False
2018-11-26,Exclusive: Venezuela rejected BP bid to buy Total's stake in gas block - sources,Exclusive: Venezuela rejected BP bid to buy Total's stake in gas block - sources Reuters,https://news.google.com/rss/articles/CBMizAFBVV95cUxPR256eU1wTlJ2TE9uS1lLaUU1b1g2SXRoTmhCeWxsMHR4ZUcwTThkeGtkaWgwdHdXSWFxM19GaUprSDkzTzVOajVBbDZURm5ZaGdXZmF3VWk1TFEtR2JnRlhzOEQ5MWp4REFRYU5xZVVWZ1NYTGtaMzBTWXAyWjdvZXdhWHdNZWx2bnVCdWtOVmlmNGRkU2huWkF6SDJqc2RMX1d0Tnd1eHhiWnhHV01RaWdyU0VXOHBuSkFaOEFQVDlJM3BReUFuOTdzYjE?oc=5,Reuters,supply,OPEC production,0,True
2018-11-26,"Crude oil output, exports drop in October for Mexico's Pemex","Crude oil output, exports drop in October for Mexico's Pemex Reuters",https://news.google.com/rss/articles/CBMiuAFBVV95cUxPZzg5c295ZWI2NDNkRmRDajZxZHJtVmxzOFpyNkc0aTZBWDVkdzBkMjhoREtWbkRiNVFsRzViOGFaYlZhUXhLUFJuWHB2RFVsam82M3B0dURQakNia2ZJNXZSQVdIN25nbS1hWjBWc3hSRmwxR25PUjg0X1NJdDQyVk1hVEZmUU1EZHNhT2dKeWN1M2VGbHM5Q2VmdUdSeVM2cFc0OHAwV2xwMWh0THlLNWhxRV9JaEhR?oc=5,Reuters,supply,crude oil exports,3,False
2018-11-26,Saudi Arabia pumps record amount of oil as Trump piles on pressure,Saudi Arabia pumps record amount of oil as Trump piles on pressure Reuters,https://news.google.com/rss/articles/CBMivwFBVV95cUxQSFk3bnNzQi1hX1l2UnNrNEdVV3ZrZFNuTXVGQkEteGJNcTF2V0dmNkVMb2dsaUd5V041SlBIRkEtczJ2WUdRcFJQd1JLWWxvN1JIX0lIMmxvUHgtTWNlTnU5Q0ZqUTdsNkxCVGVSZDZZcmRLVkFuQW9VbmxZSV81QWtNS2MtMkl0MjJIQk5WNzNGOEdUeThiMkVBd3BZX21CRUNOYTVrX2NpQlRXR1h0YzNvMWg2cGM2dXlBc3VLdw?oc=5,Reuters,supply,OPEC production,1,False
2018-11-21,Exclusive: U.S. weighs sanctions on Cuban officials over role in Venezuela crackdown,Exclusive: U.S. weighs sanctions on Cuban officials over role in Venezuela crackdown Reuters,https://news.google.com/rss/articles/CBMiygFBVV95cUxPU1dYWXBwbjVvcldsYk9RdzF5bDBOd2tsbGlvdXJyVFZ1SEhjMk9vaXhZdGdYV01TLVptTGh1aDhNQzU2TGE0UEV1eFBpUkt2SW5QN2htUWZBMk02ak5pdWdCY3NKTUo0QmNSU3BkblNmREhFbTJ6TXNLOVlaQkF4T1MyNXdpejhsTVdPcnBXY3lBWVhRSnFuZkM5YlV6MHZILWhWNnJWcmh5TEZkRWU0X1ZPRzNhdmxLZFgtR21uMDdSVHBmV0JPQUFn?oc=5,Reuters,supply,crude oil exports,0,True
2018-11-19,Cimarex to pay $1.6 billion for fellow Permian firm Resolute,Cimarex to pay $1.6 billion for fellow Permian firm Resolute Reuters,https://news.google.com/rss/articles/CBMivAFBVV95cUxPYTNjOTFlMTBYeVNISGJBRVoydUtnOHJvbWZHM3VCVDRDY2NTa2hBZS1LZzlVSEgzZHVoemlnZ2kteDVNZDhRUHhSb2Y4RHoydlY0OE1BdW9Mc0RoWm5naDhDX3FFLXo0c2dnRUMyN3NOUmY4R25QLVBjYmdHYklCRWRwVzNXVERKMnNEdmJXSkkxWTVQTF9yN2ZpbzNHSlpwODhrRUFTbVZIM0xvejhEcjUxZWpsSXE2Z3ZRSA?oc=5,Reuters,supply,US shale oil production,0,True
2018-11-15,"'Crypto hangover' hammers Nvidia's outlook, shares drop 17 percent","'Crypto hangover' hammers Nvidia's outlook, shares drop 17 percent Reuters",https://news.google.com/rss/articles/CBMiugFBVV95cUxOVmstbmtEcWlPYzhPd3QxMlY3UEtUTFFaMlJvVGVsNUVqQ1BuRjFtczA3empDUzRDNmtaUE9XZHFFRk81Wm5rMDdjQWhEbm1HTDU4a1BOTm8zQ0pNOXhOaWFlc2d3bVNodlVZMlRZbWNhUUcwM2s3X2Nma29IbFd1Ny1MWGQ2SWdTY2IzN2lXSTV3THowTk80bGRRT2h4ZUcyVGRkSUdpcDZHdjlLdWYzS2ZmbmV5MHdGSXc?oc=5,Reuters,supply,oil inventory,-1,True
2018-11-14,"Exclusive: China Inc's mounting stress - funding woes, shrinking profit growth and a trade war","Exclusive: China Inc's mounting stress - funding woes, shrinking profit growth and a trade war Reuters",https://news.google.com/rss/articles/CBMixwFBVV95cUxPQXVnRTRKZ1pLNTAyMjJNWEdlcE40a1FNX1J5Sl9iTzFlVVoxanpjVDhKTDk2NXcwSzBBRGhEbXpqMmdnVTgzUnczMEU4VW90MFNJNWxpeV9ad0ZGNVNwZTg1NzdpNVlHaGhMNHFBZXJOSEMwV2hZLVJxLTVENlNTdzJMUXVrS2lnV0FGRWRneTUtaG5hMFVGNXdRczFvd1B2Q0xaX2cyTlJqUlNkaXBkS1lUQjU3UkFmN2dqNjBxeEU2M3R4WVZR?oc=5,Reuters,supply,oil inventory,0,True
2018-11-11,Oil pucks and pellets; Canada eyes new ways to move stranded crude,Oil pucks and pellets; Canada eyes new ways to move stranded crude Reuters,https://news.google.com/rss/articles/CBMiugFBVV95cUxNVElJeExSRktoaVFoemhqTThPWDlQb1p6cy04dllxV3JmUXVIZFQ3T2dueFRyUy1QNnJNdFZ2N3Z4NmtJMW83aXRWUWtVcWYtRzRORnFfUjVjTWdHSVB4SVJZVGJkOGhSWm51N1BRNFp4c0JSVGhORFBZaEI4UTVyRnVmWmsxZWJvTDlEbFl3ZDZLUTdvQzNZS3M1REtKb0dRX2NneWlDQnJKRmszeUs4VE83QlFjdmVKYUE?oc=5,Reuters,supply,crude oil exports,2,False
2018-11-11,Why are Iraq's Kirkuk oilfields so important?,Why are Iraq's Kirkuk oilfields so important? Reuters,https://news.google.com/rss/articles/CBMinAFBVV95cUxNVFdxRHF3RXdBeDNSNEFlZm43eTlsNGsyb2QtQmg4aGxhSnRjVEliTGpGcV9HN250TXZSOFJha1BvWkZzNEdVS3otTF9rcHBPVnlYWXN5cEFsdDBBeVRUNkJNZEc4VFNRTUc2YW9idUZ3Y3lhY0hLQWM5SDhDR19JZXFRSzAtYmEtMXBhemtVZ3A4bG1tUHp4YmFrVzE?oc=5,Reuters,supply,crude oil exports,2,False
2018-11-09,"Raymond Plank, former CEO of oil explorer Apache, dies at 96","Raymond Plank, former CEO of oil explorer Apache, dies at 96 Reuters",https://news.google.com/rss/articles/CBMitAFBVV95cUxPWFJMTjM4TVBoSXJUYXAzWU9aX2ZyYXRmcWlZOGpOczlSVEptWWYyemNxTE1kZVJibHVadUxlb3puZVhQNWpXVDVNN3UzWTFpQXVxaEU3ZlBWRFRjejBvT3VsZ0RQMmRZZHg5alg5Ymk4N21rSWQyYkxXbkZ5TTJBdkJzX3VDenZYWFNvTUVXRVBPUmhRLW1QbjgwS0RBMU81MnhhM0JPNVFIczZYZUs2X180Q1U?oc=5,Reuters,supply,crude oil exports,2,False
2018-11-08,Factbox - The knowns and unknowns of U.S. Iran oil sanction waivers,Factbox - The knowns and unknowns of U.S. Iran oil sanction waivers Reuters,https://news.google.com/rss/articles/CBMitwFBVV95cUxPRlpKX2ZQMVpfb2xPMUlveVY0UnNsTHlHaTFUYk51N0ljS1hKblVja0VkM1pmNjJWd2ktSmlPVzlYRWd5UkQ2WmdiTmJXZ1VvR25VTndqZHYzeERqZ3ZZank3V1F3bXZhck5yWmRMZm5kM1d0MjgwNWdOZUstREx6b2JLTnhaRGRDR3VYeENwX3VlWkJkVXZlNjluLVpKNGNPZF9HNF9ZaEItU2xsUEZQcElhb1h1Tmc?oc=5,Reuters,supply,crude oil exports,2,False
2018-11-08,Iran's economy to suffer but likely ride out U.S. sanctions storm,Iran's economy to suffer but likely ride out U.S. sanctions storm Reuters,https://news.google.com/rss/articles/CBMitgFBVV95cUxQOGhtQ05SQ1NBY29Vai1EX2tOZUFNVjZIc25QTGFJVV9xbjJ0NzRUOFVvaWh1bkRCOHpOSENPU2JnSHk0ajViUkRNeW5SNmpZdGpRQUhscVFiNkNFckc1WVpSVmFoUFprT0ZEdnBpaWZIeW5Ub1lHRWJ5RVRmNTlYNXFVTUR2WnVSeHp5NFVZbkJERTJfUHJoUWxBQWwyX2c1SDJ1Q0NjeWJnU00xcTRHei1GT015QQ?oc=5,Reuters,supply,crude oil exports,0,True
2018-11-07,"Ahold ups stakes in U.S. grocery war with mini-""robot supermarkets""","Ahold ups stakes in U.S. grocery war with mini-""robot supermarkets"" Reuters",https://news.google.com/rss/articles/CBMiuwFBVV95cUxQX3VrUlVtUDY4YlRySXFQZzkyb0M0bi0tSGdUUEhfcDRyTXFCUkpXNEtETVBBdVVkUlVKYkl0Q0V4OGlubUVzd3pZLW9UMjdHQ3dxY2ZwSHF2TFZvMWRpdm9xb241RDJYWDZGVjdRTlM5cEc2X0lkMWp3cjVFR25aSWlrZ0xrSUJNcWowREJLX3UzX3V3bGZ2S053NUk0WXJfUkJRbTd0MGlhczdSeXV5Ml9xYXdBWEdTelRB?oc=5,Reuters,supply,oil inventory,0,True
2018-11-05,"Rouhani says Iran to sell oil, defy U.S. sanctions - TV","Rouhani says Iran to sell oil, defy U.S. sanctions - TV Reuters",https://news.google.com/rss/articles/CBMipgFBVV95cUxNMDJtaDI5Vi1ReTh6Si05ZEx3bms5OXpFa0Jta1R1cWl0SFp2eklwMF9jNHJ0ancyWjY2cm1xMzJQTUZNRnRyX3RWaVh2OUloSFhDdWMyQmVyWk81blRKZzhES242UG1NZ0MxTmMzcUJpM1ZNWDE5OUFhcXAzQUN1LW1TbGNHRHlOOTZicFNmOV9wVlExS2lKODFnV19MNTBVcG5SejhR?oc=5,Reuters,supply,crude oil exports,2,False
2018-11-05,"Graphic - Iranian oil: 40 years of revolution, war, sanctions and bans","Graphic - Iranian oil: 40 years of revolution, war, sanctions and bans Reuters",https://news.google.com/rss/articles/CBMivgFBVV95cUxOZjZfbE90cmxHcnVxM0FaSDNSTGVkcDlTeXItSHlhVXJfbEE1S2E2bU15dWhfYWZ5MzRhZUdobTRpanFtYnRYR3pEa3d2N0xTSm1EZzFvZi1OOURpc3NfS0gzZzl6RWJCblR5aC1MSFBLM0RsMTcyRGRHV2ROOWNNMl9OZ1dWMUkzcG13N2U2cU1PQTl1N2M3d3RGaXZlWXJsaVlBUmplRGg5MmZoc095NHNkbVhzcFZMUkEyN0t3?oc=5,Reuters,supply,OPEC production,1,False
2018-11-04,Iranian marchers chant 'Death to America' on eve of U.S. oil sanctions,Iranian marchers chant 'Death to America' on eve of U.S. oil sanctions Reuters,https://news.google.com/rss/articles/CBMiuwFBVV95cUxOZExPbUtCZ0ctc3AwUUhINVJ1ZkZZOGxIY1d1U1FrSzJHY1VqcDFiUWQ4SWlJTjdGUVRXUkFGSE95ZmpPSnVXcVY4a0NiX3lURGp5ZlZsY3JjZXhNVU5rXzZrV1Z0NXBDTHJUV1B6eWhiV0ZRdi1QeGJETEVxSnYtN3l0SjYzSnB3V2NXdEZaRlg5TzloYlNUblE4NmFPcV9kVFY5R3JTYWlZTG9NR0RzNVcyTU92MENPakt3?oc=5,Reuters,supply,crude oil exports,2,False
2018-11-01,Trump increases pressure on Venezuela with sanctions on gold,Trump increases pressure on Venezuela with sanctions on gold Reuters,https://news.google.com/rss/articles/CBMitwFBVV95cUxQTXcyM1ZlTWZnaENwZ0wxQ0VIOTRuVnFFRlNxT1piSzdQUmhfc0NyNGdfSk5LeFlnUnh1bWU4SWtUQ0t0YWxBQnhnSld3eTBRdVpoblByR2o2OF8yYWRtbC0wNUJ4V1Zta1ZBOHJWbExNSWg0V1BxNGtkWjRqcVl2dllTRDBBMm1TMzFhQ1ByQmw5a2dCdUdxQkgwS0ktNFBzYTVSWGppUS14Uk41blNCRmhnd2I1dDg?oc=5,Reuters,supply,OPEC production,0,True
2018-10-31,OPEC oil output rises to highest since 2016 despite Iran - Reuters survey,OPEC oil output rises to highest since 2016 despite Iran - Reuters survey Reuters,https://news.google.com/rss/articles/CBMiX0FVX3lxTFBUeC1WMGpKOFFYLXN1V2xtVVB4SGRyVW1XUGV6UkFuX2VNSEVTRFFsLXJ2RkhneGdXdmhCUFFzNzJIdXBUWjRYakNQTUJ3SjRvcS1jYnMxbnE5Q2lvaFlZ?oc=5,Reuters,supply,OPEC production,3,False
