date,headline,summary,url,source,category,keyword,oil_relevance,is_noise
2017-07-20,"Backing of workers, communities key to Libya's oil revival","Backing of workers, communities key to Libya's oil revival Reuters",https://news.google.com/rss/articles/CBMiuwFBVV95cUxNbFBhSXQxZVVKekJZbXoza0JRdV95bXJxaVZqYklKeHAtcUNTVGZfUUhPSkpZcDY1bjM4dmc3MnVqa2ZQdVJlQkg2ZndTTlBfWklhdlEwdWhTalpCOXdjUXpQaFgwWEJaeWJEck5nRnNBZ21WMnlvelVVSjJfdHVJUnNiNnI3Y1o1MFVWcnM0RDFuOU5yX2pTbWVNb19sYkdua3ZNanlQeF9zdVY2RlNWdGozSGduWWNhSDY0?oc=5,Reuters,supply,US shale oil production,2,False
2017-07-19,Japan's June export growth points to sustained economy recovery,Japan's June export growth points to sustained economy recovery Reuters,https://news.google.com/rss/articles/CBMiugFBVV95cUxQYXZFSFlQeXN2ZEVXYzFDMGFzd0pxSDlHVG5vNzQzdWFYM0E4THhQOTNLY3RGbXBVZVJMbms1UFVGOEcwS3ZhbWhIYmNhZFQtSHpweXIwUlozLVhHZlhJRmlaZXR0UUhRcWFweXVkXzFSZGIxVUxVWktaYi1pUVRHOEtjVk5DUzNyVGpTMjhBb01NSDBHLVlPMDlzR3pDRW5mbkthTWE0dHg3dE5URkpOV0ZqUzczOVkycnc?oc=5,Reuters,supply,crude oil exports,0,True
2017-07-17,Gecina launches c. 1 bln euro rights issue,Gecina launches c. 1 bln euro rights issue Reuters,https://news.google.com/rss/articles/CBMikAFBVV95cUxQaFZtN1Z5UUM1MkVZeTlGaVQxZU4xTlVCM1BjN0lqQmF4am9pR1pYMVlGYmZmalQyVXlsRkpCUHVWck1jVFA5ZWUycnlJU0xLS2xsYy1RQVVhWFNBQmtVMDBWRWVrbHo1QzJ0a2ZXcXBLNm9SbFlwbkp5cEp0SDRWdnRaVmFyS1dhRHljRkxfLTI?oc=5,Reuters,supply,oil inventory,0,True
2017-07-17,Turkey detains 115 more people in post-coup crackdown: Anadolu,Turkey detains 115 more people in post-coup crackdown: Anadolu Reuters,https://news.google.com/rss/articles/CBMitAFBVV95cUxPU09mMVdHSVNuclFDcDJqYlNpVTM0NUt6cGJFZFhSUVZzUVhqcWg0VzNfbjhma0g5Mk55bzF2ZzJtY1Y2ek5Yc1NHQ3hfU0ZZb0dvV2llN29Pd2NWZThPX09Yck42b2J2X1BKNkJzd1ZvTU5qUzI1bzZ4TThiaHVUamhmOEg0djFFTDRoSmlkUVVBY1k5T2dsaEZMWVdUei1kaFhKNnZWRWNNd2diLU5CWHBZN2o?oc=5,Reuters,supply,crude oil exports,0,True
2017-07-16,Tens of thousands march over corruption in Dominican Republic,Tens of thousands march over corruption in Dominican Republic Reuters,https://news.google.com/rss/articles/CBMitAFBVV95cUxPblhlUkF6NEVOZU5JQWhadmdoSjE1LTJUbXFvc0tJclJhOVpsd1BFMmJpQTdqS1FMOHlud2pQWnJObFVEUENUMHlNUTJWZHBuUkE1S2VZZEJHaF9QaTV4WVp4VWNNZHl5N3VuUFJmQWVzN2otU25mTHBNZFQ2MDhadjdQLWFacUhKdV9PNWo3TjJnMm5TQi1kejlLTXFxTlAwOWJRS1dGcGFZTlVTdkEwemZOU00?oc=5,Reuters,supply,crude oil exports,0,True
2017-07-14,"Asserting sovereignty, Indonesia renames part of South China Sea","Asserting sovereignty, Indonesia renames part of South China Sea Reuters",https://news.google.com/rss/articles/CBMitwFBVV95cUxQQjc2LUh6d3JiS2tfN3JWbzZWRy1vNTdmZFhHTDdxU04taUkzOVFEODRYVmhKeFNkWUpsZ3Q3S0pxTXZzSHBjMWRJTW1NOEd3WjNQQjlFMGVuUHlkc3lZZmJFamF1TlpaUmxJWmpockdsS1VmUlUtQ0tLa2JlQkx4OE5XalVXbGp5bUJtdjdBcGxmZWRlMkt6dFBCM2lZelZjcmlGc0puZHNBb3BSVHltbUZtM210dWM?oc=5,Reuters,supply,oil drilling activity,0,True
2017-07-14,Factbox: Big U.S. banks start earnings on a tepid note,Factbox: Big U.S. banks start earnings on a tepid note Reuters,https://news.google.com/rss/articles/CBMiqwFBVV95cUxNQ2NhRXlKcmh5RjdtVmxWQkdlTGd6OF9pdU85ci1rSVE4dHhDM2UwTWpBMjNxTjhEWlZfalNFOW81c01LRkRjQlBrT2pZX3JxajRZbDBJUGFsRHQ4ZTU2ZldNVUgxT1RKNUt4V1FZeks3SEYtNHREZElqNHF0WTlBdDRCWjEzZW0tdURlT2FWSjI1bEJST3IxRll3UHQtc2pzSkY5elU3alNzRTg?oc=5,Reuters,supply,OPEC production,-1,True
2017-07-13,Germany's Daimler agrees to make batteries at Mercedes-Benz plant,Germany's Daimler agrees to make batteries at Mercedes-Benz plant Reuters,https://news.google.com/rss/articles/CBMivAFBVV95cUxNWEpXTWpreWRNSE5XZzZYRl9TX1ZadjB5MC1MQjFsV1prVEVqdUdkaGlTcjNJUHNsQ1lXOHl0eHlSNEl6dy00bzdFaFJ4cUszeng5SEZ4QTV3Z21XZC1Zajk4cFlNUzRfdUZvdl94VHpGaGpVRktGcUJoRktjOFFjOUJvbVpoRWZNY0Npb05YMk9BeVhKSnFJMWQ5ajFxWGJMR05vTzVnMzV0QU9XLTFQdm9ORFJqQ1BtOE1pWQ?oc=5,Reuters,supply,US shale oil production,0,True
2017-07-13,"Exclusive: Venezuela oil exports to Cuba drop, energy shortages worsen","Exclusive: Venezuela oil exports to Cuba drop, energy shortages worsen Reuters",https://news.google.com/rss/articles/CBMiwgFBVV95cUxQSHNtLXBNZWJOWWxmSThXQjBzaFdGMXh0ZERfVVVXa3Y1VWl2aU0wOG4xaV9fRmtRT015OXVxODJPblNxYW1qMU5JQk1zVWZldTJ5NE1yU2dSYlpZeXJNZDZYVThlZ2xlSVFaQnNWSWxMU09IMV9CU1VNcE5LeFFCTkEwdjUyckdSbDFRSWhHY01KT1ZUZnBkcnJBQmlfS2pDdURnZHp0TllWR1R5aWZ2TnpldEFaZE9zaTdmeDVpcjBidw?oc=5,Reuters,supply,OPEC production,2,False
2017-07-12,U.S. ULSD FUTURES EXTEND GAINS AFTER EIA DATA SHOWS BIGGER-THAN-EXPECTED INCREASE IN DISTILLATE INVENTORIES,U.S. ULSD FUTURES EXTEND GAINS AFTER EIA DATA SHOWS BIGGER-THAN-EXPECTED INCREASE IN DISTILLATE INVENTORIES Reuters,https://news.google.com/rss/articles/CBMi0wFBVV95cUxQTVU0WnZvY2E5NWdYQThVdmh0eHNQNGFHSlV4REUyRzFSS0ZZdlc5LUxNWEVlTGN4REZNekkyT0gxTTlyOHVGR1otLWNMZThOTjZEY19sOGprc1dhUDRCWmRTMnJOcE5IVFdZelhoOU5qREwtbWR3WFNDV1FIVndrVkpITWRXNUZDWW5DWmVWdThtdlZIWTFjUVR5NE9kb0I1MUxJckJnVVRWMFNqbEtpV2hGSHFmMWVkc3pOcVFtY0xJTlVNQUdkZlJlOXJZOUQ3VG1v?oc=5,Reuters,supply,oil inventory,1,False
2017-07-12,Transcript of Reuters interview with EPA Administrator Scott Pruitt,Transcript of Reuters interview with EPA Administrator Scott Pruitt Reuters,https://news.google.com/rss/articles/CBMieEFVX3lxTE9JODJfRjZ2UDBtTENSUXMtWWNTeXpnajNVZkJDbWNsQlZPb2FKa2JnRi1UN0NpT1BVZUEtaHRBaUhhbGlBcGZfMnRuRWtaY21ZcldienBEMG82UXNHeWRwSHJuQ3dscThtTkpMNF9IM1YzODJYc1doVg?oc=5,Reuters,supply,oil drilling activity,0,True
2017-07-11,"EIA cuts U.S. oil production forecast for 2018, remains at record","EIA cuts U.S. oil production forecast for 2018, remains at record Reuters",https://news.google.com/rss/articles/CBMitgFBVV95cUxQYk1CbDdQOXBrQ1luWGdMOXNwTHBrZDcxZ1ktZG9lV2FDQ2pHZVV0S2hZUVU2MHBaSnZNTnZHWkpONjV4WUJzVy1IeDktRVdXUF9vWFYwN1MweE1MVVRrLURla3BLSjhIX0dfQ0JmcVRkR196YzhPZnlrSHZsc1VfWkJsQjJJb2JMZ2ZMQnljc0F4Q1NjbFBfRGhzeWdscW52dUMzV1lRNVFSV2Y5N1N6dy1ubEZ6Zw?oc=5,Reuters,supply,OPEC production,3,False
2017-07-10,"UK's BMW workers accept new pensions deal, ending dispute","UK's BMW workers accept new pensions deal, ending dispute Reuters",https://news.google.com/rss/articles/CBMisAFBVV95cUxPeW9obGJndENpMVV3eHJCVWdJb3hDczUzdXQ1dU5SZ2I5eGpRUTBIdnNDY1RHZHVHRkNSVFh6TVJZUGQtYm5BalZkZEFoWFNIbTlETXRaNHkzUk5SUmdjVUVDYUpGUl9ucmIxVTBwM1ZXemtkd3dVaU9yOTZGRDB5Nld3STdEbjRaSHgydTFCMS1VWk15dXlJdkJhWjZ6cFJkbHN2Z1hyYnRVcVNPMkhGdQ?oc=5,Reuters,supply,US shale oil production,0,True
2017-07-09,Peace at risk in Nigeria's oil heartlands as locals' patience wears thin,Peace at risk in Nigeria's oil heartlands as locals' patience wears thin Reuters,https://news.google.com/rss/articles/CBMiwAFBVV95cUxONVI0ckhTd0pXb1h1R1QtX1lMNlRIOUpLdG9FQkozOUJjUXRpb1ZsaGFIN05sVmx3bUtNaXVibmQ2NkF6bjdSR05DRG8wUHZlZHBJSmE0NHNKVG12b0NUdlBGNWYyX0RmcUVMWnkxX0dMMkJLbnE5akVYdVd4a0tFVDdPemJGbnREbDQ1eHBablZscUkycTdPOVhtcVQxaGZFS3ZhOWRBaDN2NFd5aWtGYmlnQlpoZlhleW1SZG9IYm0?oc=5,Reuters,supply,crude oil exports,2,False
2017-07-09,Lupin sets off down Indian pharma's long road to redemption,Lupin sets off down Indian pharma's long road to redemption Reuters,https://news.google.com/rss/articles/CBMisAFBVV95cUxNdzNFVGl2SDRIeVhzUjNkX1BKLTNsUDJ5WkVVSUd3bFZ5WndMSDRPRU9DSXF3NnE2Sk5uZXRaOVo0WTVmeFhId1VwazBvaUMySUdRTUpjN3VPUXVNOHN6cmdTdUZLQTFnNXVUWllGek5zZnpnLXhMN05pSGlmeVYwaUlLeENWOG05bHRiOUV0X1BBUnBqcFBtemxPQjg0MldRNXlVb1BJLXJJcHdlbHRXbw?oc=5,Reuters,supply,crude oil exports,0,True
2017-07-08,Inside the G20,Inside the G20 Reuters,https://news.google.com/rss/articles/CBMic0FVX3lxTFBfX1ExazNyZFBibWg1dk5hTHVRMDZydzRPcTcyZV95Ri0xWVlLOUlBWmoyWGszcWJydUhNam1OVW44Y2tWX2JSMjY5eGNtd3Uya1lEaEZZZllmbVlic0xJZTdreENETjNybFJrNFpnY0QxTUE?oc=5,Reuters,supply,crude oil exports,0,True
2017-07-08,"Even U.S. first lady couldn't keep Trump, Putin on time: Tillerson","Even U.S. first lady couldn't keep Trump, Putin on time: Tillerson Reuters",https://news.google.com/rss/articles/CBMitAFBVV95cUxPN1ltbXNQUVZZb2s4X0tVN1oxUGJpekg1LThLcVEyZy1walBoQ3VRWXNrY2N1Y2ZvTlJZWnRyWXRLeWJwa2ZVNC1aeW5Cdnd0ZXdRXzFJaHNQVWhEWVlBTEdGbGIteVhVU0VMdy16bFU5VExPU0RaUUxPOTBnQVFBbTN3TTlpOFNLR09rX0pOQ21JZFZwdDZyQmV6Vnk3SkJOYzhqbXNTR3FRbTNvZ200ZkdIVXo?oc=5,Reuters,supply,crude oil exports,0,True
2017-07-06,Vietnam renews India oil deal in tense South China Sea,Vietnam renews India oil deal in tense South China Sea Reuters,https://news.google.com/rss/articles/CBMiqwFBVV95cUxQdjctWFR3S0l1SmFtUFhLTmVPMDR6aWlndHYyR1BiYUQ4VklPc2hFMTdtQlMwUzVxWURUeG9nclp6dVZwemt0WDJWTldBaUhLSTlfQjlqTzZLekRIbU45M3p5cHZuVVhsdlZhTWFTT2hpWHhRUTdzUzN4UG0zeTBRdnZyRnpSaDRLMmJheDRiOVgyMHFNVjJmbS15bVZuTGFyb1ZZVmI3WVRMTmM?oc=5,Reuters,supply,oil drilling activity,2,False
2017-07-05,Halliburton buys Summit ESP to strengthen artificial lift business,Halliburton buys Summit ESP to strengthen artificial lift business Reuters,https://news.google.com/rss/articles/CBMivwFBVV95cUxPM2ZKeXY1Q05yX0RJdmtGUGI0bUl4TFVBY1U2ZGZ1M2JQcU1IUnllanpZeGNoaVZyY0owdVpjdWZONjhkeEUySldQM3o3MWFQak5jX2RKR0t5MzFoeHMwRjdjb1BCVHhwN3p5N1FSR1Rzd04wRm96a1JTbkxGS3lxSDlaYkVIS1p0MHFURWRGVG83c2o1a1FhdDFSNDdFZWQwbnd4cjdYdlNkX05GMnlJblBVWEw5Um9XeDZ3UGtGZw?oc=5,Reuters,supply,US shale oil production,1,False
2017-07-05,Halliburton buys Summit ESP to strengthen artificial lift business,Halliburton buys Summit ESP to strengthen artificial lift business Reuters,https://news.google.com/rss/articles/CBMiyAFBVV95cUxOWUN3dDhfdk5aeWFnbDYxV1JsTGJrMmFHdVZ5eXMtYUtDdTJYRmlXN1NhM1NCY21qb2ZXRHB4UV9QZnBVNzlQVUZfeTAycGFhM1BDOWliVDB3VHBnT1JoSU1ueHVIRFhScU16clhmQS0yT1lHaDA3Zlp5eUNsSWR5SW9zOWI3T0dscE9LRHh0em1oa1ppTnRlazRpYktweFFfS3czQVRYZnA5SWhxOUxaWmpVMlRQalhxNEN2X3JORm5ob25HNTRUUg?oc=5,Reuters,supply,OPEC production,0,True
2017-07-05,"Pakistan State Oil seeks 905,000 T of oil products for Sept","Pakistan State Oil seeks 905,000 T of oil products for Sept Reuters",https://news.google.com/rss/articles/CBMiswFBVV95cUxPTzA3WTRWTFk0S25wYkZhc2FtODhWQTU2X1VDTi1GM2txNWlQUzFOQXotSTVjbk9YdUJPQno2RWJ1dDh3NW9EcW5mSUJRMU5EckNab001azhxbDF4Nm1oQlk5ZGVxc2RNSHJzQ1k2UEhKS1BkREVveENrcDVvQ0p2SnhlMTlsVkxlZ1Q1bkZyZE45cGRhYm1SckQ2Y2FmaFhERW1DQktnTGR4c2J5OVdXVWpLNA?oc=5,Reuters,supply,oil inventory,2,False
2017-07-03,Sonangol to respond to Cobalt's $2 bln arbitration award request,Sonangol to respond to Cobalt's $2 bln arbitration award request Reuters,https://news.google.com/rss/articles/CBMivwFBVV95cUxPbTI4dVhsZ1hOSnljM1o4cjJMbDlzM1lmYmEyQmhRQmRhVzNhMmJ4UHI2X0xfOTJtVUhSRm95bEV4RmlLOV9DbjNYbmh6aVFzUUktTDBiUGw5SXdjS1VwekZ3TkhvaXpkUFNyVmliUEwzZFNldVdLaGJDZllpQ05leE9DMGdxWDVOWDluaHhka0NWMGFXdGFLa2JQRkJXeXduTmVCVjE1aDRqTm9BRHhRZ0s1bXdzd1BTd2F3VXNBbw?oc=5,Reuters,supply,crude oil exports,0,True
2017-07-03,"GE closes Baker Hughes deal, becomes No. 2 oilfield service provider","GE closes Baker Hughes deal, becomes No. 2 oilfield service provider Reuters",https://news.google.com/rss/articles/CBMixwFBVV95cUxOX2ZQMllLRjBNOGdlWGp4OUdqX210YnA0RmRWWk5jbV82Y05BelVTRF81YmJuSHhNQl9rWV8wZ1BLQi1WelhpamJ0M19DVXBHc1NIUk5WUk1FRWJVRUVZVl9Jd09US0p4Zmd4NWhfdnB0NUZjeXFSLVhnWkYtRlN6Y1pJU1UtSWZiOWc4TXE2UHVEclVsbWZuUGh5ak5qUndsVU9yOC1UdER0NmtiRmg0NHVBaW9oTGY5b3E1X3pRTWZLY2djcjNJ?oc=5,Reuters,supply,crude oil exports,2,False
2017-06-30,S.Korea exports post double-digit growth in June for sixth month in a row,S.Korea exports post double-digit growth in June for sixth month in a row Reuters,https://news.google.com/rss/articles/CBMi0AFBVV95cUxPY0pFQXZKSE9CWHhmc3FTdVN3bFlMVlNhRTM2dmhYbGlKUXBPR3B3OUVYTUJuNGEtbEZmTTB2UEtSTnpGRFE5RUlkeV83b3FLN1FOZVYxVHhjQ2NXRU9UTDVweUNxLTd1NzZoXzBuc0oyTG9RUS04T095VHYyUEQxZ2l5aERzaGdhSFdqTS1QemRPcGNyWHF0VTVrOGpPNjBqWThGR2ptUVhYbkFZeWtUMVZhT0lHYjVxVEg0ZGpCU01JVWVRaEJSU0ZHRjh6WHBq?oc=5,Reuters,supply,OPEC production,1,False
2017-06-30,Wells Fargo Asset Management appoints Jonathan Hobbs and Kevin Kneafsey,Wells Fargo Asset Management appoints Jonathan Hobbs and Kevin Kneafsey Reuters,https://news.google.com/rss/articles/CBMixAFBVV95cUxORENWQWQ0Y3JYalBJWHpqYW1Fd2ptMHZ5N29uTTRJczEtdTF4UWhUdjhaajZ0clJvVjBpaHdmc2pScFdDUDJkMzM2Tm54czgtYnM5MVg0SVRFSkNXQjJRa0xfOEdtbzdkYWxxa2dJNDJ6aUh3VmpmTmZGZW04Snl3VTJYTjV5UkxMN2lRSVVqZUZUelNZVFQ5eE9fWDBFX21JNVYwdTJLTHp1d1ozWVdMX1kxOHVsTVN4Wi1rZENpaHR2VnpJ?oc=5,Reuters,supply,crude oil exports,0,True
2017-06-30,Rongan Property's unit wins land auction for 638.8 mln yuan in Chongqing city,Rongan Property's unit wins land auction for 638.8 mln yuan in Chongqing city Reuters,https://news.google.com/rss/articles/CBMiygFBVV95cUxNU2pta0JGSVItM19Xb1VHSTZ6clR3bHhjTHdwRHdKTlN4Yy15aUhLRjhnVVpvUXdGcXRfMHJDb3JRWVZkQ1Vfa3ZMQXJjQUpaOExSSks2aXVNbTRWUkM2SDVwdUVrRWw2NFZ4ZEtsdHFGLWpxU2RHUHhNQzVmQXU5QkFpSE1BWTNZbGU2S3hfTFNHZmNPakZQd3RZZGQxc2pKa1J5M0owODJ1d2FJUEtlRVVWc20yMURHd1U1Uk9QUVdJWnB2bFdrcDBR?oc=5,Reuters,supply,US shale oil production,0,True
2017-06-21,"FTSE under pressure as Provident Financial plummets, oil stocks slide","FTSE under pressure as Provident Financial plummets, oil stocks slide Reuters",https://news.google.com/rss/articles/CBMibkFVX3lxTE41OFFvZFZ3bmJXbkh4X091bHVabllJQ1hGYzNZZjhmMXZXcGdGdkx3LUQ1bFFwQXhVbGpPcXpLUmlBQ01rcC0xWXNwS2I2Y1h6Q0w5TEFLdFNibFBQRHNnU0VILVRNWjJaTzF2d1Zn?oc=5,Reuters,supply,oil inventory,2,False
2017-06-21,Saudi Arabia's Mohammed bin Salman appointed Crown Prince-SPA,Saudi Arabia's Mohammed bin Salman appointed Crown Prince-SPA Reuters,https://news.google.com/rss/articles/CBMiwAFBVV95cUxNWE1TT2tRY1F2RUlDejZSR2NZU3dZTkVUMzBOeldMZDBoYkxmcnJUMDluVW5UQlIxQ0JHZEZMaTJ0Y3VURTFFNnU5WW5OeXh0UzJrdjJZbmNZcDF3eXFFOUphaG9QcGZzWGc0bFctcjRHanZHUms0aFplSkNveHM4c3Voc3VtdUhxdEhQakNaVFhqS3M0dkhFclBPVjlpeURpekV5ODNQcWtZbFRwZFFkblpTcGc1S0QzRm9tdzNMVlc?oc=5,Reuters,supply,crude oil supply disruption,0,True
2017-06-20,OPEC should heed lessons from Achnacarry Agreement: Kemp,OPEC should heed lessons from Achnacarry Agreement: Kemp Reuters,https://news.google.com/rss/articles/CBMirAFBVV95cUxOTUg2am5mQzBhbWd6WHFaWEVYTFVOd0pmYjJoMDBjTzd5eF9HZU50aVFNZjU3SW15QTdPTEZEXzNzeU9pcWc1NmNFSG1pNTJtem9uV2g0WjBBZ0FRTXZmQjd3a1NwSkFZSDNJNERhcjhtMG5sNVd5bzNycXFYTmotdVZoQ0w1WGduT2kwUUdHbjNZOFdCbThJNVdqaE10bzMzd0NJNWlFMVgxV1Za?oc=5,Reuters,supply,OPEC production,3,False
2017-06-20,"From Middle East to Argentina, France's Total bets on cheap resources","From Middle East to Argentina, France's Total bets on cheap resources Reuters",https://news.google.com/rss/articles/CBMiwAFBVV95cUxPMl9Bdkp1TEdMY05UUmotdUYwY1hjcmdnZFo5M2U1dEJYTnJkQmZWbEI4M2JqSWJQbEQxZHFWS1VxazN3ZjI5MnhlNXVrV2NEaDNhUEdnT3JiVmI0QWY2OFF3WmRGYWJPWE5BS25Oa1lHT0htaDVrUnJCRFB5OE51aU9fMldCVnVyNTU2SUlQVFhKZGl5Mnh3Ry12RVdEdVE0elNsalEyOEJsb2ZjWlJFclN5WHRCY2pmaGlzUkVOTmk?oc=5,Reuters,supply,OPEC production,0,True
2017-06-16,Fitch Withdraws Volgograd Region's Ratings,Fitch Withdraws Volgograd Region's Ratings Reuters,https://news.google.com/rss/articles/CBMinAFBVV95cUxPM2pZY1VpSFFodHFhNnpFQlc1elFIdlNCMWN6UHltd2o2eVgyaV9UTUxnZ0VWaHhZSC1vTy1ZZkxXc01IMmppWGkyZnpxWHBaTGdPQUhpUm1EaWhFN1pQcEZ3MzBJUGJuN2xUNnRsQUhaZ29YUW85dkVuNEdla0FoeHNNdVR1NGc0c1lxQzJSbWpSUWJRcVJRbWxPdWk?oc=5,Reuters,supply,oil inventory,0,True
2017-06-15,Irish watchdog says proposed mortgage bill would stunt competition,Irish watchdog says proposed mortgage bill would stunt competition Reuters,https://news.google.com/rss/articles/CBMi0wFBVV95cUxOM0NyeHpZZUl2YklIUUpiWmpyLTZYdFp1R3E5Y2pzT0IyU3hRX3BGRVJfY2lkdnN6TGNrT2Z4WENZU1ZVRDVxaXpOMjhRMGRjOGwwTGZRWUpXTEM3SGFZQ19qY2N6UDFTYVByMVpMY2FHNkM1aEVNcEV5UmQ4YmlSWWJpVmgwdWk3V1BlZ2F3dVVxNWVVeG41dGZwRERuR21ieklQdDBXR3M0OWJmVlhLRTdvU2toWHN3UVoxdnpyT3pXVVZsNjFOeHhQMmNjQ2pPSi1R?oc=5,Reuters,supply,oil inventory,0,True
2017-06-14,"Russian shares near 1-year low on US sanctions risk, oil, rouble","Russian shares near 1-year low on US sanctions risk, oil, rouble Reuters",https://news.google.com/rss/articles/CBMi2wFBVV95cUxNVlozWjgxZGlEWDdGUElmdFM3aHVSYkZGRTFJT0t6Vkt1SzdYeXhESEhnblphYlZPQVY0UkNaUVRZS1JnX240MGtoLXRJRmlSaDFOU0xHTFYxY21FTDh4amZKUzkzX0hPZGYxN0JXeTRLSHJKU0VtWG5BRU5vcjR1RDBzOUw2bUM2RllFOXR2Sm9iQU43QVV6MDFXZnc2RnFqd09hZGRQNEZFeC1KZmNlZEVlTkhlT1J1STB3VkFfRWlZSzhQZDh6UThtS0NhNTFQcXpoZEdKYWttNms?oc=5,Reuters,supply,oil inventory,1,False
2017-06-14,Nigeria's exports up in July on Forcados restart - loading plans,Nigeria's exports up in July on Forcados restart - loading plans Reuters,https://news.google.com/rss/articles/CBMivwFBVV95cUxQQUd0SG53YTlqMTVBci00SW12cjZXV1VkcjhjRjZibElHaDlJaWVyQTZNVWxaT0ltMHBQQ01zM1hSYmFPc1VjelFyRjhURHFkZmhkLXBsaWE2eF9RVUprTmR4VFhoQ0lDVllEWElDS1RiMkVsOEtEQ1ktTE9SaExhb01tSW9HdGlDal9qNlVVR0F3NjZ3OU9yT2k3VWhDVlRUd1B1bkxxdzFoUjNHczF4VzFTYWYxbjh3S3hrYkVZRQ?oc=5,Reuters,supply,crude oil exports,2,False
2017-06-14,"OPEC's simple problem. Despite Saudi cuts, it's shipping more oil: Russell","OPEC's simple problem. Despite Saudi cuts, it's shipping more oil: Russell Reuters",https://news.google.com/rss/articles/CBMigAFBVV95cUxOOXBHVVpwX3gwNzZrQUk4NFB0aUFYWk9oVFRIR3A1QzRUQmh0YmlNVG9zd1lpMjd0R2hEQkkxQm1yNEFhaFBFX24wS0ZuTnlfY2FnOE1SYjZiQ1BsQXVwWlhlQXY5M1Y1Mnltdlc3dmpYSm5ZVU0yRWxCNXJGb2ZNbQ?oc=5,Reuters,supply,OPEC production,3,False
2017-06-14,NRG Energy's GenOn unit files for bankruptcy,NRG Energy's GenOn unit files for bankruptcy Reuters,https://news.google.com/rss/articles/CBMiqAFBVV95cUxQNm1wX25ncHpZV1B3dVFEbXFJUVZqVHlhZVp2ZjdlS0o4N2JwMDdVd0hDN0F1VjJXMEhRcG44QldjdGNkeHJsT1hEOERDUk9lREN0eE43QmFSTGhyclVfaXdKenhGQnBVc2h4ODRyeGxqWkExRW53TmlHcHVnZGM3WVdYWUNiSFRjYmhaenFFWHZJd3R3UVlGQXZLNnJsZXl3VnV5VGFCNjU?oc=5,Reuters,supply,US shale oil production,0,True
2017-06-13,Panama's business chiefs hope for big return from new ties to Beijing,Panama's business chiefs hope for big return from new ties to Beijing Reuters,https://news.google.com/rss/articles/CBMivgFBVV95cUxPNUZERHZvdWJkMmsyUjc2MGhyQngtZUx3bXhHWFRDTkVyNTJtd0FrWGdjUXJ1X1dkWm1vcHFnaXA5YnNkMUh1X3lJTzhrY0NuTC1yaTRwUEJmWWJhaTVabWJHNEFpb3RnQ2pXT1FjdmFMNG43ZWhsOEZTSkVDN3FER1JOamM1ODFSU1hNV1VhSWtLRTZjcmtoTXRaQWd2ZWVKRU0zNTE5S2tRRWlKTGlLX0ZMQXNhVl9ZUVFDRnZB?oc=5,Reuters,supply,oil inventory,0,True
2017-06-13,"Panama establishes ties with China, ditches Taiwan in win for Beijing","Panama establishes ties with China, ditches Taiwan in win for Beijing Reuters",https://news.google.com/rss/articles/CBMivgFBVV95cUxNREZ2X2xIZEl6aWl2eDlhUUtqTjRyME1VRmJpZEZKYk5raHZHUGZGVUZxRnIyVS1pSWFFZi15RHFQZDdaR0VkR245ZVV0THpOU1poMkpVdUpzTGNUZXV4RlN1MFpKSDdPel9FaTVJZ1VlS1BUdGhhUEhvVGZtdER3bE5xa2Q1SnBLUnZGSFQ3a2RaTzhTWVBmb1ZEZVVjcXFQQ05uM2ZjOGhFOGNqRWM1eVRWLWJxLW56NWpfcWt3?oc=5,Reuters,supply,crude oil exports,0,True
2017-06-12,"Panama ex-president, accused of political espionage, arrested in Florida","Panama ex-president, accused of political espionage, arrested in Florida Reuters",https://news.google.com/rss/articles/CBMiwAFBVV95cUxQTElKZ1VWSDZRbkxBRUxTWEF3TVZKQjFJOWU1RnA0LTM4cGVDNzB3aEJHaWpEZUV5SjVFZmJ1UlJWUGMza3I0VUFpRWNDMlFDLWxoMGVnblVzSXo1S0h6T28xZFRxa2pWSVFmQkh2NlF5elMxM2tGR2txVXFfaml1Ymw2V21SdTV4a2JTUm9NNzZGMXhoemV4UEY2QVF5N2pLQjdLWGZkLWIxZjY3bjFTRGxPaWdibmx2eWFTSHF1TVY?oc=5,Reuters,supply,crude oil exports,0,True
2017-06-10,FACTBOX - Review of U.S. national monuments could unlock new energy reserves,FACTBOX - Review of U.S. national monuments could unlock new energy reserves Reuters,https://news.google.com/rss/articles/CBMiwwFBVV95cUxNek83dFN3bmFWNUtDdlZISzItQ0xUQzhNS3N3bDlRRjB1RUpLVzczWThpeU1mN28zWVB0dHkxWkUzRWp3djJ0d0JUQ01qMWIwVmFoaGljNzdEWGNLMHVhdmpIbkY4MXZydGdQVXNnZUIxbUkwbWx1Y2R6a3lzdG1xdjR2RWZwcjhEdUNtZjdpRFl4VkNDUUlHaHpfTENXYWl4VG5PYy1lSTVFZXBVSWRCekhQRmJwYXpxeXlSSVdEOHdSVm8?oc=5,Reuters,supply,crude oil exports,0,True
2017-06-04,"Big oil, small U.S. towns see new reward in old production technique","Big oil, small U.S. towns see new reward in old production technique Reuters",https://news.google.com/rss/articles/CBMivgFBVV95cUxOdm5FSjFUakllRVc0RF84eVM5OW9INGlwNnVvajk3SFhhc0tJcG1RX0lRWmxJZTlfWW5TTlpxQUVJOUhJbFhlaHJYVE1CWndoR3Fjd21DamZhQThwZFBKZEI0MjlkcHR1WHBVRXRGM2JHV1BKLXEtaFBfN2JVLUNLMWY2UjZNeUZDTmhJVEFPUFFDdmJuVzRZN1RKX25yTy1Wa0FJcmRwbTB4TmFEczBCaWowclM3QVpyWGduZFdn?oc=5,Reuters,supply,US shale oil production,3,False
2017-06-01,Germany's Daimler to take minority stake in Chinese electric car venture,Germany's Daimler to take minority stake in Chinese electric car venture Reuters,https://news.google.com/rss/articles/CBMi5AFBVV95cUxQR3AxR2xfMkZXUDdGRE1FTjJCYlI5UHV5dDhRNkNDWGR4Z1o2b1ZjeWdQNnBaYVMyalRnOHNLNHptQU1OM21VTGE2S3g1TE9QcjVpeWJMT2x2TzBwbUpRVzVtREQ4UExhSjVOZWxqWU83SFlNU21TeDZmamJHMUE5QmpUMU9DMEsyQXhaMi1RYXVITzBEdlFGODd1dEF6cW1ZVHljdFNPTUxNLWVKQWt0QUpCczVEQmVXd1Vsb3I2LUowdVdhNWFOczRXc19OTUlyNjE4T3BudFBUNGNkNk56ajA3QVA?oc=5,Reuters,supply,US shale oil production,0,True
2017-05-31,U.S. pending home sales fall; housing market recovery intact,U.S. pending home sales fall; housing market recovery intact Reuters,https://news.google.com/rss/articles/CBMiswFBVV95cUxNSUdQS0pPbW9UZXhGNnZ1cWJTNWxicTcwcm9kSXlMNGJfUkJLcWZOaERSTjN3N0pRbXMwMkVoSUVpNmxodmVnVUNpT1dBMy1ZSnZwVU9ZZzVGQmY4dnlPMWZkNXZXMm9lMEpTM29TR0hlVGhtS3djR3MwcnBSdHhxYVpHUnIwbUZ5SUlOOUlBNk82dVRzV2NLdDlXRGNBNU4tU3l2RmVRWXJxeVBaVTJxZloyYw?oc=5,Reuters,supply,oil inventory,0,True
2017-05-30,パナマのノリエガ元将軍が死去、1980年代に独裁政権率いる,パナマのノリエガ元将軍が死去、1980年代に独裁政権率いる Reuters,https://news.google.com/rss/articles/CBMiaEFVX3lxTFBPY1lIWHYzampIclhMVkI0UEg2WjdZbFZRbVdUSEF5MHRjcWRYcDlYU2FCUlFuLXNQa2tLd05lWnZYN0JhSXFlSy1hZUdteFlCVTA1Rk9uNXNicXpUWEVRTHJRZEI2Vml5?oc=5,Reuters,supply,crude oil exports,0,True
2017-05-27,N.Korea leader Kim guides test of new anti-aircraft weapon,N.Korea leader Kim guides test of new anti-aircraft weapon Reuters,https://news.google.com/rss/articles/CBMisgFBVV95cUxOaTZ5VldmMFAzTFE5dFBYNlRLUTRqVVZCakJrcXVqdFNLb2h0dXEwYzQ5RkhNNGdfXzd6ZWZveGFuemFuNGJnNnRTNTJSQU5uUU1uOENqdFdfLTJaVTJKcndYbm5EVnB4bW1nX1N6Tm5SUHB6RlJnc2JNd05KN3ZfLWtRaVluaWUzVXFyRFhQeFZESElBQnZ3SW11YV9jVkhSMmxPV0RPZnJIaXo5VHF3dHVB?oc=5,Reuters,supply,US shale oil production,0,True
2017-05-26,South Sudan refugees scrounge for scraps as rations slashed in Uganda camps,South Sudan refugees scrounge for scraps as rations slashed in Uganda camps Reuters,https://news.google.com/rss/articles/CBMixwFBVV95cUxQY3lHTkZSaEI5WjdDMXBtUXppMXlhQmE3RTlGR1Z4ZlVBNVM1TDBIVzJqMktSNGd1bUwzQWt5TmlDOFYyTW5mRm1kWTVZbmQ0UmtPdGdSYzQ1NzRaTlBkZVdSY0gzTkE3dUVyMGpRUV9VcEVqX25XNS1INFk4TVB2NmxvZi1FUDJJSEZsRFJ1VUpqQjZoSm1hOXBXbGJVLWFZdGNtVmZvU1YtalpOZDBMbDRuWENHSjV4R2xfOUpuX1p6RzBnUTVn?oc=5,Reuters,supply,crude oil exports,0,True
2017-05-25,Saudi Aramco to spend $18 billion on growth in the Americas -Motiva,Saudi Aramco to spend $18 billion on growth in the Americas -Motiva Reuters,https://news.google.com/rss/articles/CBMivgFBVV95cUxOZVhSc0I2WjJUbVAxQkl1V2c3RlRudlhpODNIdm91aGloT2RHejh1NFZWWlROb0FGVE0zUkRzNngyOWs1cHlnZlhTVVB6OHJCU2k2cHJDR1Fac3Y5Y1FVVWloelR6amRybHZlT0sxUmVSTkdCQUtwRTd3cl9hLXk3VG13Vzd4SFdKeGNTLU1TSTdEX0NYeGpHRTFfXzlDTWRYN3J3N216dFhYaW91QnZnU3hxeWN1Zzg3dFVmX2FB?oc=5,Reuters,supply,crude oil exports,0,True
2017-05-24,U.S. oilfield service firms lag shale recovery; old deals hold,U.S. oilfield service firms lag shale recovery; old deals hold Reuters,https://news.google.com/rss/articles/CBMitgFBVV95cUxNc1FmNVVxdjJvTWlyMDFudlJYd04wMk1GWE5HQlJBdTlUcldiX242TU9rbHQzNExlcGRST0U2aURQWjdoei0tTkViak5Ca0YxMXdYVVM1VGhkaXVLQkY3T3RKTTVnV2hFZzNEbi14QW8yWEZteXpvLW5MaHQwVjA5bkFIVmtwWWpXT01aT1hHTTdHYzE3RXpqT0FZcGlHT0ZLWlRaVW8tSnFPeEV6LXhJbnNrRXRZdw?oc=5,Reuters,supply,US shale oil production,3,False
2017-05-24,China to tear down 15 million shantytown homes in 2018-2020,China to tear down 15 million shantytown homes in 2018-2020 Reuters,https://news.google.com/rss/articles/CBMisgFBVV95cUxPcDhlMDdsT3NmVVJlQ1M1UHRLLV9JMTBQTm9IdGhNa0pvRzJJbEZOdFJUNXZ6NHBIbzhucjA0WU5YVUtKc1NiclVFSS1ndXl3SnJTRmU0Rk45MkIweE5LalZIS3lHbFM1RUY1eUNtWUsyeGFWVFZmVVpPbllGblRCTk9VMGlQdW00aGJuVEZkZWVqN19qclo5RWhicmxtaUlwdExGQkR0Ynd6LXE0MkVzbE5n?oc=5,Reuters,supply,oil inventory,0,True
2017-05-23,India's KG Denim March-qtr profit falls,India's KG Denim March-qtr profit falls Reuters,https://news.google.com/rss/articles/CBMimgFBVV95cUxPNUs1WUtGQUVPS2M2WTQtY2tfZXBxUFFPb09GdWRmeVNtQjNIOTRnelZmOUxfUGQ2WFRvb2JLV1ROa3lCbXVZbU5FdTVrYXRNMGRNY2lfbTNvWEU3STB5ZmRDdWxpSlNKdk9WM1RrNUtBTlR5TjFWUlBVNVA5ZjVzeE82TGNPcDg0Q0p1ZlNDZnVnbHNaOW9sZEZR?oc=5,Reuters,supply,US shale oil production,0,True
2017-05-23,Algeria says OPEC discussing 9-month extension to cuts,Algeria says OPEC discussing 9-month extension to cuts Reuters,https://news.google.com/rss/articles/CBMicEFVX3lxTE9UMTBsMGtRMkplTmdqODhBTmw1alRJQ3FDYlpLbnRkdlU4bGtpSkxTd1ZfcmNBbHdPNl9jRzljUndxMnY3alVwRF9EQ1B4bGRwcEktZXk5akNFVnJHZjhRa3hyb1I0c184VDRmNkdhRXI?oc=5,Reuters,supply,US shale oil production,3,False
2017-05-22,"South African refinery blast injures 11, some operations halted","South African refinery blast injures 11, some operations halted Reuters",https://news.google.com/rss/articles/CBMixAFBVV95cUxNbV9pMDZZZmc3czBabmg0RXJnTWZ5OXFrbWFvNUd6NDV4WWJQRUh4bkduN1RJM0ZfN0gtZXhxRmJmWXNrUllWekhKWXNIQVB6cGhlMk5WOHVBVU1hWkkzRDBaZWI0bExrbVpWRVdyanRMV091MXlDYmhJaTVNbmlpUnlBYXdiekc2U2E3YTJkOXVqTlBGX0psWG1wMG9BSG5mTDF4aXo2d3F6RUd5clA5MktEVm9WX0RqRWM4WkZ6cHRIcTYx?oc=5,Reuters,supply,oil inventory,1,False
2017-05-22,"Exclusive: Venezuela holds stock of 5,000 Russian surface-to-air MANPADS missiles","Exclusive: Venezuela holds stock of 5,000 Russian surface-to-air MANPADS missiles Reuters",https://news.google.com/rss/articles/CBMiywFBVV95cUxPLW9HUENjaGYxWTFobnlWeGdLM2R0Y3dtUG12TWUtQ3RlNGlJMEM5UzNRUzBvUFhNSkhYTF9NRVlIbGVId3RoNFg3OW1UZnY2OXdLU19NTzNIbjg3X3BHQ1hJb1NxZXkySm45V0tVTmdTelVTa01Wd3dUQ1Q4WmFHVS11aXpVSGRTa3FJUjdodGlFVWlXanpSVXhOQ3lUTmhBWjItLXRQZ1hKVVRZd0JRWHNJM2EwUGE4R1RZZ1hNYWVMUS1vb2haMlFRTQ?oc=5,Reuters,supply,oil inventory,0,True
